type,name,values,prefix,postfix,usage count,user addable,template name
checklist-flat,WrapShield,,,,,,WrapShield
checkpoint,"Substrate must be dry, clean and free of any contaminants.",,,,,,
checkpoint,All overlaps must be a minimum of 80mm on horizontal and vertical seams.,,,,,,
checkpoint,Inside and outside vertical corners should be at minimum 150mm of overlap.,,,,,,
checkpoint,All installation must be with the lower courses lapped under the upper courses.,,,,,,
checkpoint,All air bubbles must be smooth out to ensure full adhesion.,,,,,,
checkpoint,Apply VaproLiqui-Flash evenly at least 50mm onto the face and at least 25mm out along all sides of the penetration.,,,,,,
