resource,type,Add Step,Add Post,Tier 1,Tier 2 ,Tier 3,Tier 4,Tier 5,Tier 6,Tier 7,Tier 8,Tier 9
,step,,,Security Gate House,,,,,,,,
Roof Installation Checklist (Security Gate House),checklist,,,,Roof Installation,,,,,,,
Flashing/Capping Installation Checklist (Security Gate House),checklist,,,,Flashing / Capping Installation,,,,,,,
Roof Penetrations Checklist (Security Gate House),checklist,,,,Roof Penetrations,,,,,,,
Eaves Gutter Installation Checklist (Security Gate House),checklist,,,,Eaves Gutter Installation,,,,,,,
