"Rich Type","Id","Warnings","type","name","values","prefix","postfix","Usage Count","User Addable","Template Name","Template Id"
"button","656256ef-ec1a-470c-8ea9-695f94a16386","","button","Tempering valve installed","Yes, No",,
"button","21d0e1b1-11b4-4c41-a720-5c8d6f0597d3","","button","PRV installed","Yes, No",,
"button","9ec5993c-0ca8-410b-9d29-e205ec69021b","","button","Meters labelled with the correct unit numbers","Yes, No",,
"checkpoint-status",,"","checkpoint","All Copper Risers Work completed to specification/drawings & Area left clean/tidy"
"label","b6f8f086-811d-4eae-beb5-555ce0eac5a7","","label","FINAL - Pass when happy to proceed with work(s) (Any issues please comment below)",,,
"checkpoint-group",,"","section","Handover"
"checkpoint-status",,"","checkpoint","FINAL HANDOVER HOLDPOINT - All Copper Risers completed to specification/drawings & Area(s) left clean/tidy"
"label","204e93ba-ddfd-4db8-8a4a-1d25f9e75384","","label","FINAL - Pass when happy to proceed with work(s) (Any issues please comment below)",,,

"checklist-sectioned",,"","checklist","",,,,7,"No",,"0cae102ca26a364d31fab0ade621bea6895746a67b5ab40ada49b37e59e27226"
"checkpoint-group",,"","section","Room Aerial Drainage Installation"
"checkpoint-status",,"","checkpoint","Workshop Drawings for construction & approved"
"text","4d5508cf-a9c1-4510-8bd3-b4c3eace0b83","","text","Hydraulic Drawing & revision number(s)",,,
"checkpoint-status",,"","checkpoint","Check scope of works/specification & ensure all documents are current"
"checkpoint-status",,"","checkpoint","Check for any purchaser upgrades & ensure required changes are installed if approved"
"checkpoint-status",,"","checkpoint","Fire collars cleared of concrete slurry & logged to Firedoc"
"checkpoint-status",,"","checkpoint","Approved Material delivered to site and stored/ secured safely"
"checkpoint-status",,"","checkpoint","Sewer services installed correctly as per workshop drawings"
"checkpoint-status",,"","checkpoint","Stormwater services installed correctly as per workshop drawings"
"checkpoint-status",,"","checkpoint","Drainage risers and vent riser services installed correctly as per workshop drawings and schematics		"
"label","3f557bb4-b6ab-4a14-83e2-2c0fcfad7b92","","label","Minimum Grades installed as per AS3500",,,
"button","cb10b91c-8b7f-4da8-a7c3-249a66a2d2ef","","button","Bracketing installed as per AS3500 and manufacturers specifications","Yes, No, N/A",,
"button","7db32d47-84f9-4443-9583-40cbf5045989","","button","Sufficient IO's installed for compliance and maintenance requirements","Yes, No, N/A",,
"button","797809f4-502d-49a4-b54a-07912ea0f77c","","button","Pink primer and Blue glue used only on UPVC","Yes, No, N/A",,
"checkpoint-status",,"","checkpoint","Hydrostatic test filled with water to a height not less than 1m above soffit level of highest pipe for a minimum of 15min"
"checkpoint-status",,"","checkpoint","Correct fire collars installed with test reports on file. Retro fit floor waste collars installed"
"button","4bae5cc6-9586-4950-80fd-15bbe3e7358f","","button","Fire penetration stickers installed and photographed","Yes, No, N/A",,
"button","dd6ec1d0-d09c-4dec-b6ce-a8135a48c2f9","","button","Smoke seal all penetrations","Yes, No, N/A",,
"checkpoint-status",,"","checkpoint","Pipes labelled as per AS3500"
"checkpoint-status",,"","checkpoint","Co-ordination with walls and other services overviewed and co-ordinated onsite"
"checkpoint-status",,"","checkpoint","Acoustic lagging as per project requirements"
"checkpoint-status",,"","checkpoint","Sponges installed in Floor wastes"
"checkpoint-status",,"","checkpoint","All points capped off to ensure no builders debri enters system"
"checkpoint-status",,"","checkpoint","Update Asbuilt drawing immediately"
"text","cff781d7-52a4-4168-b20e-2a5f7f94f19d","","text","Confirm IL of pipework",,,
"checkpoint-status",,"","checkpoint","Clean up & excess material stored away"
"checkpoint-status",,"","checkpoint","All Drainage works completed to specification/drawings & Area left clean/tidy"
"label","1a3c0c44-7256-4fac-b7d4-9b78dcdea8d6","","label","Pictures of works completed - Attached below",,,
"boolean","2f58ca19-1301-464b-8122-b57896791076","","bool","Builder's Signature added below",,,
"boolean","9a865b22-91f8-44e1-bce1-64ff0c482aae","","bool","Plumbers Signature added below",,,
"label","636d169e-af75-42af-985b-9221935a7590","","label","FINAL - Pass when happy to proceed with work(s) (Any issues please comment below)",,,
"holdpoint",,"","holdpoint","Click to Add Plumber & Builders Signatures (If applicable)"
"checkpoint-group",,"","section","Room Rough-in Pressure Services Installation"
"checkpoint-status",,"","checkpoint","Workshop Drawings for construction & approved"
"text","51bdf6c3-86b5-4721-b53d-de228474f23e","","text","Hydraulic Drawing & revision number(s)",,,
"checkpoint-status",,"","checkpoint","Check scope of works/specification & ensure all documents are current"
"checkpoint-status",,"","checkpoint","Check for any purchaser upgrades & ensure required changes are installed if approved"
"checkpoint-status",,"","checkpoint","Bathroom setout off current Architectural drawings"
"checkpoint-status",,"","checkpoint","Approved Material delivered to site and stored/ secured safely"
"checkpoint-status",,"","checkpoint","Cold water services installed correctly as per workshop drawings"
"checkpoint-status",,"","checkpoint","Fridge points installed for 3 & 4 bed apartments only"
"checkpoint-status",,"","checkpoint","Hot/ Warm water services installed correctly as per workshop drawings"
"checkpoint-status",,"","checkpoint","HOLD POINT - NPCW services installed correctly as per workshop drawings and schematics"
"button","8d328fb3-8e1f-473b-b0a5-73a0cf5dcff3","","button","Ensure NPCW pipework is installed and spaced as per requirements of Australian Standards and Fair Trading","Yes, No, N/A",,
"button","5846168d-12f1-461c-8419-e93f58e7ded6","","button","Department of Fair Trading inspection for recycled water services","Yes, No, N/A",,
"checkpoint-status",,"","checkpoint","Bracketing installed as per AS3500 and manufacturers specifications"
"button","5f2e2082-ca22-4a1d-a9d0-38181b822a01","","button","Check for any cross connections","Yes, No",,
"button","5748c87b-7f54-4245-bae2-9b2c34faf24c","","button","Grommets through studs and silicon where pipes cross","Yes, No, N/A",,
"checkpoint-status",,"","checkpoint","Basin wastes and toilet waste offset and tested with water if required"
"checkpoint-status",,"","checkpoint","Internal cistern installed and tested. Ensure cistern is installed as far forward"
"checkpoint-status",,"","checkpoint","Inwall mixers installed and tested. Ensure Mixer is installed as far forward"
"checkpoint-status",,"","checkpoint","Loop re-runs to be fire rated, labelled and photographed"
"checkpoint-status",,"","checkpoint","All setouts ok and run eyes over crimps"
"checkpoint-status",,"","checkpoint","Smoke seal any pex pipe going into meter cupboard."
"checkpoint-status",,"","checkpoint","Hydrostatic test filled with water and pumped @ 1000kpa. Ensure shower mixers are off and test the shower head on its own"
"text","b8020354-bc9d-43dc-b622-67b0fd70fcc7","","text","Record start time and stop time and provide photo evidence of gauge",,,
"checkpoint-status",,"","checkpoint","Leave all services under pressure while apartment is being finished"
"button","4099f3b0-d9c2-4a25-a20b-c4b522a9c379","","button","Correct fire collars installed with Firedoc logging","Yes, No",,
"button","c70e15d2-bd72-41df-81c2-46a4d5d1628a","","button","Fire penetration stickers installed and photographed","Yes, No",,
"checkpoint-status",,"","checkpoint","Pipes labelled as per AS3500"
"checkpoint-status",,"","checkpoint","Coordination with walls and other services overviewed and coordinated onsite"
"checkpoint-status",,"","checkpoint","Thermal lagging as per project requirements"
"checkpoint-status",,"","checkpoint","Clean up & excess material stored away"
"checkpoint-status",,"","checkpoint","All Rough-In works completed to specification/drawings & Area left clean/tidy"
"label","53705c8f-f3df-46dc-bbc3-7ba31b091660","","label","Pictures of works completed - Attached below",,,
"boolean","a7028c53-576e-4cdf-8e54-299874f317ee","","bool","Builder's Signature added below",,,
"boolean","a9ed6772-4e59-47ce-94db-cf37b76ed86f","","bool","Plumbers Signature added below",,,
"label","78c5b6e0-e457-44aa-9389-40bc1b74ff46","","label","FINAL - Pass when happy to proceed with work(s) (Any issues please comment below)",,,
"holdpoint",,"","holdpoint","Click to Add Plumber & Builders Signatures (If applicable)"
"checkpoint-group",,"","section","Pressure Risers Services Installation"
"checkpoint-status",,"","checkpoint","Workshop Drawings for construction & approved"
"text","b9c8750d-584f-401b-8a3f-4994718b8a62","","text","Hydraulic Drawing & revision number(s)",,,
"checkpoint-status",,"","checkpoint","Check scope of works/specification & ensure all documents are current"
"checkpoint-status",,"","checkpoint","Approved Material delivered to site and stored/ secured safely."
"checkpoint-status",,"","checkpoint","Hot/ Warm and cold water services installed as required to risers"
"checkpoint-status",,"","checkpoint","NPCW service riser installed and within required separation distances from other services"
"label","ee1e7ec8-cb69-445d-880f-a7db0fca39be","","label","Shut off lever valves installed",,,
"checkpoint-status",,"","checkpoint","Temp Valve Installed Correctly HW, CW, WW"
"button","5a65c8ad-b321-4a95-a6d0-7ccdf9a6e3fd","","button","Check Filters on Temp Valves and clear","Yes, No",,
"checkpoint-status",,"","checkpoint","Bracketing installed as per AS3500 and manufacturers specifications"
"label","e088ab96-4f19-4b79-ae16-3deb9f990aea","","label","Witness marks on all press fittings checked",,,
"checkpoint-status",,"","checkpoint","Grinders for cutting pipework prohibited"
"checkpoint-status",,"","checkpoint","Water services pressure tested @ 1500KPA or 1.5 x working pressure. Whichever is higher for a minimum duration of 60 minutes"
"checkpoint-status",,"","checkpoint","Gas services pressure tested @ 300KPA for a minimum duration of 60 minutes"
"label","05f36025-9a3e-4594-b236-a28c8bffdc89","","label","Provide photo evidence of testing gauge",,,
"checkpoint-status",,"","checkpoint","All services left under pressure during construction"
"checkpoint-status",,"","checkpoint","Pipes labelled as per AS3500"
"checkpoint-status",,"","checkpoint","Fire rating to service riser with pipe wrap if required"
"button","160d4fd3-318b-4928-a167-1b500d2bd1cb","","button","Fire penetration stickers installed and photographed","Yes, No, N/A",,
"button","bf5756ca-df0f-4a4e-a5fc-826c6954002d","","button","Smoke seal all penetrations","Yes, No, N/A",,
"button","ccd25989-74d5-4964-90ea-1ff9939ff854","","button","Firedoc logging of all fire rating items","Yes, No, N/A",,
"checkpoint-status",,"","checkpoint","Coordination with walls and other services overviewed and coordinated onsite"
"checkpoint-status",,"","checkpoint","Thermal lagging as per project requirements and AS3500"
"boolean","4498271c-5833-4250-9b27-302263cb13b7","","bool","All points capped off to ensure no builders debri enters system",,,
"boolean","f7a0ed08-4b2b-48b9-af62-11a5acd1e678","","bool","Pipes labelled as per AS3500",,,
"checkpoint-status",,"","checkpoint","Coordination with walls and other services overviewed and coordinated onsite"
"checkpoint-status",,"","checkpoint","Thermal lagging as per project requirements"
"checkpoint-status",,"","checkpoint","Update Asbuilt drawing immediately"
"text","370c58e8-8703-4249-ac6a-2200f574f618","","text","Confirm IL of pipework",,,
"checkpoint-status",,"","checkpoint","Clean up & excess material stored away"
"checkpoint-status",,"","checkpoint","All Pressure Riser works completed to specification/drawings & Area left clean/tidy"
"label","cf49630c-45b2-4550-a92b-e0458853f845","","label","Pictures of works completed - Attached below",,,
"boolean","2c30bfa2-cfe7-48cc-8470-44d9fd5357c8","","bool","Builder's Signature added below",,,
"boolean","f31fbd90-e6af-4b8a-bd8d-a53b10c560f2","","bool","Plumbers Signature added below",,,
"label","fb9d9c95-b5a9-4f2d-b16d-a8b021334b3b","","label","FINAL - Pass when happy to proceed with work(s) (Any issues please comment below)",,,
"holdpoint",,"","holdpoint","Click to Add Plumber & Builders Signatures (If applicable)"
"checkpoint-group",,"","section","Final Fit-Off Services Installation"
"checkpoint-status",,"","checkpoint","Workshop Drawings for construction & approved"
"text","e46824d1-74b3-4c76-9cb4-adbab9bdef69","","text","Hydraulic Drawing & revision number(s)",,,
"checkpoint-status",,"","checkpoint","Check scope of works/specification & ensure all documents are current"
"checkpoint-status",,"","checkpoint","Check for any purchaser upgrades & ensure required changes are installed if approved"
"checkpoint-status",,"","checkpoint","Bathroom setout off current Architectural drawings"
"checkpoint-status",,"","checkpoint","Approved Material delivered to site and stored/ secured safely"
"checkpoint-status",,"","checkpoint","Install WC, Connect Water & Clean Silicon (If Needed) & Tighten Flexis"
"checkpoint-status",,"","checkpoint","Flush Toilet 3 Times (check water level and leaks)"
"checkpoint-status",,"","checkpoint","Ensure mini cock is not blocked with lockseal"
"checkpoint-status",,"","checkpoint","Hand Basin & Mixer Installation (SOLID) , ensure cover plates are installed


"
"checkpoint-status",,"","checkpoint","Vanity opening and shutting fine/ no scratches"
"button","f9fb2f7b-1836-47e6-a04c-755a5723b8e0","","button","Connect Waste (FILL & TEST BOWL)","Yes, No, N/A",,
"button","d77bb31c-d426-4e7c-97d3-1ea2c3579436","","button","Remove Trap & Clean Out (Tighten Trap) and  Check Flexi's For Leaks & Tighten","Yes, No, N/A",,
"button","98e10148-a0ec-488d-86f0-91f0a59eee16","","button","Basin water working (Clean Aerator)","Yes, No, N/A",,
"checkpoint-status",,"","checkpoint","Seal Shower Mixer & Install Flange"
"button","a105e3d8-61dc-4779-99d1-7f8d505fcdef","","button","Shower Rose (Run Water & Clean Filter)","Yes, No, N/A",,
"button","41304fbe-83d2-4390-8104-a947df01af6f","","button","Test Shower FW & Main FW - Clean Out","Yes, No, N/A",,
"button","c27bee1d-60f0-4043-b974-4ce5b33f5d6c","","button","Install shower hose on rail


","Yes, No, N/A",,
"checkpoint-status",,"","checkpoint","Clean up & excess material stored away"
"checkpoint-status",,"","checkpoint","Fit-Off works completed to specification/drawings & Area left clean/tidy"
"label","f9f599f4-c06f-4183-ade4-f712016a81b3","","label","Pictures of works completed - Attached below",,,
"boolean","b7359bdc-7f9b-4c68-b179-143febe6f913","","bool","Builder's Signature added below",,,
"boolean","89c726dd-0f6e-4af9-9136-4ce6e5a1df21","","bool","Plumbers Signature added below",,,
"label","575c582b-0ad0-4991-99dd-88619dff38b3","","label","FINAL - Pass when happy to proceed with work(s) (Any issues please comment below)",,,
"holdpoint",,"","holdpoint","Click to Add Plumber & Builders Signatures (If applicable)"

"checklist-sectioned",,"","checklist","",,,,2,"No",,"020c6e04738fb244a74220fe25481e5432d8957122ac9726503a8f2507679693"
"checkpoint-group",,"","section","Prestart"
"checkpoint-status",,"","checkpoint","Latest consented drawings checked & referenced"
"text","2bd7ba1b-484d-434a-aabf-99f8df35e87c","","text","Drawing & revision number(s)",,,
"checkpoint-status",,"","checkpoint","Work area accessible & acceptable"
"label","4c3af574-3d3a-4576-ad6c-5d64fd76bd8b","","label","FINAL - Pass when happy to proceed with work(s) (Any issues please comment below)",,,
"checkpoint-group",,"","section","Kitchen"
"checkpoint-status",,"","checkpoint","Kitchen Sink & Mixer (SOLID)"
"checkpoint-status",,"","checkpoint","Remove Trap & Clean Out (Tighten Trap)"
"checkpoint-status",,"","checkpoint","Sink Connected - Run water & fill tub to rim (Check for Leaks)"
"checkpoint-status",,"","checkpoint","Tighten Water Flexis, Clean Aerator"
"checkpoint-status",,"","checkpoint","Dishwasher Installed as per below"
"button","1421d58a-78ab-4884-9450-2e90d96c8cf5","","button","Lead plugged in & water left off until permanent power is on","Yes, No",,
"button","8af1479c-f486-412b-b778-f76005c7791a","","button","Dishwasher Hoses neat at the back of Cupboard & cover plates installed","Yes, No",,
"checkpoint-status",,"","checkpoint","Check Drawings to see if AAV is required"
"button","80b7c6cf-f58f-4610-b9f0-70d07f5a2e72","","button","If AAV is required, is it installed","Yes, No",,
"checkpoint-status",,"","checkpoint","Install & Connect Cook Top (Check Silicon, clipping & Gas Connection)"
"checkpoint-status",,"","checkpoint","Protection Installed (Attach Photos)"
"checkpoint-status",,"","checkpoint","FULL Dishwasher cycle run once permanent power is on. (Leave the power on)"
"checkpoint-status",,"","checkpoint","Purge Gas on balcony or internally with doors open, Ignite Cook Top & Test"
"checkpoint-status",,"","checkpoint","Hot Water timed to unit"
"text","c87d7591-0d97-4f43-be4e-d85d7e85bdd1","","text","Time",,,
"checkpoint-status",,"","checkpoint","Final - Pass when Kitchen work(s) complete (Any issues please comment below)"
"checkpoint-group",,"","section","Laundry"
"checkpoint-status",,"","checkpoint","Tub Installed (As per below)"
"button","061fda42-a2b4-4490-99b4-7fd65cc43170","","button","Installed Square","Yes, No",,
"button","380025c0-508e-48e3-8327-e99c4410c6fc","","button","Mixer Tap (SOLID)","Yes, No",,
"button","ec8e5df8-220b-4f27-9189-5118bd093040","","button","Trap removed, cleaned out (Tightly reinstalled)","Yes, No",,
"button","150094cd-0662-448d-bfda-852d4734e0c1","","button","Laundry Tub filled & Drained (Checked for Leaks)","Yes, No",,
"button","5809952b-03b3-4508-ad1d-d62e6f0fd942","","button","Door on Tub swinging the right way","Yes, No",,
"button","a5529a3f-ea43-4335-8b6b-57d592c8b083","","button","Tub Protected (Attach Photos)","Yes, No",,
"checkpoint-status",,"","checkpoint","Washing Machine taps Installed Under Tub/Opp Tub"
"checkpoint-status",,"","checkpoint","Test & Clip Washing Machine Waste (If Applicable)"
"checkpoint-status",,"","checkpoint","A/C Tundish(Cap if there is no Tundish by AC). Ensure 25mm airgap achieved."
"checkpoint-status",,"","checkpoint","Tighten Water Flexis"
"checkpoint-status",,"","checkpoint","Cover Plates Installed"
"checkpoint-status",,"","checkpoint","Check Drawings to see if AAV is required"
"button","3f8f7cd2-164c-4f46-aa69-8a1978885370","","button","If AAV is required, is it installed","Yes, No",,
"checkpoint-status",,"","checkpoint","Clean aerator, Remove Trap & Clean Out (Tighten Trap) & Test Floor Waste - Clean Out"
"checkpoint-status",,"","checkpoint","Final - Pass when Laundry work(s) complete (Any issues please comment below)"
"checkpoint-group",,"","section","Bathroom 1"
"checkpoint-status",,"","checkpoint","Install WC, Connect Water & Clean Silicone (If Needed) - Tighten Flexis"
"checkpoint-status",,"","checkpoint","Flush Toilet 5 Times & check for leaks behind hob (CHECK WATER LEVEL)"
"checkpoint-status",,"","checkpoint","Hand Basin Installed (As per Below)"
"button","43aa326d-9ef6-416d-b9b1-5cd2f779e50d","","button","Square & Level","Yes, No",,
"button","e85b4b27-c41e-4399-84d4-df803964be50","","button","Vanity Opens & Shuts fine/NO scratches","Yes, No",,
"button","00a7bd67-9129-42e6-ac67-e9f1f5895d25","","button","Basin Mixer (SOLID)","Yes, No",,
"button","4bf26c04-6e11-4000-8df8-caea08f69723","","button","Water Turned ON & Flexi's Checked for Leaks Then Re-tightened","Yes, No",,
"checkpoint-status",,"","checkpoint","Waste connected (FILL & TEST BOWL). CHECK NO LEAKS"
"button","d307c004-c732-493a-8fc6-fd3730f1f19f","","button","Cover Plates Installed","Yes, No",,
"checkpoint-status",,"","checkpoint","Seal Shower mixer & Install Flange"
"checkpoint-status",,"","checkpoint","Shower Rose rail (Run Water & Clean Filter) - Collect hoses & heads"
"checkpoint-status",,"","checkpoint","Bath Installed (As per Below)"
"button","d471a548-8e13-40d4-8b05-2989ec69f6b5","","button","Bath Fill Tested & Water Run Test Completed","Yes, No",,
"button","1a2e212d-ca21-4324-8938-855f3150f949","","button","Bath Spout & Mixer Handle Tested - Clean Water","Yes, No",,
"button","58ee75a4-3327-4cbd-a45a-00376dd40cc3","","button","Protection Installed (Attach Photos)","Yes, No",,
"checkpoint-status",,"","checkpoint","Test Shower FW & Main FW - Clean Out (Attach Photos)"
"checkpoint-status",,"","checkpoint","Install Shower Hose on Rail"
"checkpoint-status",,"","checkpoint","Clean aerator, Remove Trap & Clean Out (Tighten Trap) & Test Floor Waste - Clean Out"
"checkpoint-status",,"","checkpoint","Final - Pass when Bathroom work(s) complete (Any issues please comment below)"
"checkpoint-group",,"","section","Bathroom - Ensuite"
"checkpoint-status",,"","checkpoint","Install WC, Connect Water & Clean Silicone (If Needed) - Tighten Flexis"
"checkpoint-status",,"","checkpoint","Flush Toilet 5 Times & check for leaks behind hob (CHECK WATER LEVEL)"
"checkpoint-status",,"","checkpoint","Hand Basin Installed (As per Below)"
"button","f54b7eee-b3b2-42da-a585-033c731eb438","","button","Square & Level","Yes, No",,
"button","a7995487-0660-4b11-99a7-ebc4ca549c62","","button","Vanity Opens & Shuts fine/NO scratches","Yes, No",,
"button","439ceced-ec25-4897-8b08-0b9c41e6f697","","button","Basin Mixer (SOLID)","Yes, No",,
"button","aca06f1e-b395-44da-b375-3b5578dd7583","","button","Water Turned ON & Flexi's Checked for Leaks Then Re-tightened","Yes, No",,
"checkpoint-status",,"","checkpoint","Waste connected (FILL & TEST BOWL). CHECK NO LEAKS"
"button","6f62c3a6-d52e-4856-978a-77a9bdac2b39","","button","Cover Plates Installed","Yes, No",,
"checkpoint-status",,"","checkpoint","Seal Shower mixer & Install Flange"
"checkpoint-status",,"","checkpoint","Shower Rose rail (Run Water & Clean Filter) - Collect hoses & heads"
"checkpoint-status",,"","checkpoint","Bath Installed (As per Below)"
"button","9e60aeb6-168a-4db8-aca9-654b9dfcdca1","","button","Bath Fill Tested & Water Run Test Completed","Yes, No",,
"button","273bfddc-56a6-44c3-a5ab-653f356e4135","","button","Bath Spout & Mixer Handle Tested - Clean Water","Yes, No",,
"button","b69c7117-822e-48f7-84aa-57399044346f","","button","Protection Installed (Attach Photos)","Yes, No",,
"checkpoint-status",,"","checkpoint","Test Shower FW & Main FW - Clean Out (Attach Photos)"
"checkpoint-status",,"","checkpoint","Install Shower Hose on Rail"
"checkpoint-status",,"","checkpoint","Clean aerator, Remove Trap & Clean Out (Tighten Trap) & Test Floor Waste - Clean Out"
"checkpoint-status",,"","checkpoint","Final - Pass when Ensuite work(s) complete (Any issues please comment below)"
"checkpoint-group",,"","section","Balcony Drain"
"checkpoint-status",,"","checkpoint","Clear RWO"
"checkpoint-status",,"","checkpoint","Check Gas Bayonet for Leaks & Installed Correctly"
"checkpoint-status",,"","checkpoint","Check Hose Tap for Leaks & Installed Correctly"
"checkpoint-status",,"","checkpoint","Final - Pass when Balcony work(s) complete (Any issues please comment below)"
"checkpoint-group",,"","section","Meter Cupboard"
"checkpoint-status",,"","checkpoint","Gas Meter Bar & Meter Installed - if applicable"
"checkpoint-status",,"","checkpoint","Gas Tested with Manometer - on hold for 10 minutes"
"checkpoint-status",,"","checkpoint","Hot & Cold Water Meter - Correct Direction"
"checkpoint-status",,"","checkpoint","Check for Leaks/Clear filters"
"checkpoint-status",,"","checkpoint","Temp Valve Installed Correctly HW, CW, WW"
"checkpoint-status",,"","checkpoint","Set temp valve temperature - no more than 50 degrees"
"checkpoint-status",,"","checkpoint","Pressure reading in unit, Set & Clear PRV. No less than 250kpa or more than 500Kpa"
"text","a152cc68-dbfd-480a-a5c4-069249ad7350","","text","Pressure Reading",,,
"checkpoint-status",,"","checkpoint","Final - Pass when Meter Cupboard work(s) complete (Any issues please comment below)"
"checkpoint-group",,"","section","Handover"
"checkpoint-status",,"","checkpoint","FINAL HANDOVER HOLDPOINT - All Commissioning QA completed to specification/drawings & Area(s) left clean/tidy"
"label","179d5931-75c1-49c4-8f89-0c0f6b01379d","","label","FINAL - Pass when happy to proceed with work(s) (Any issues please comment below)",,,

"checklist-sectioned",,"","checklist","",,,,1,"No",,"1cc8ac43c18f973f2e5ce94c8c4ea419d4f2c5fe8459cf664e882ec683b1e239"
"checkpoint-group",,"","section","Prestart"
"checkpoint-status",,"","checkpoint","Latest consented drawings checked & referenced"
"text","2bd7ba1b-484d-434a-aabf-99f8df35e87c","","text","Drawing & revision number(s)",,,
"checkpoint-status",,"","checkpoint","Work area accessible & acceptable"
"label","4c3af574-3d3a-4576-ad6c-5d64fd76bd8b","","label","FINAL - Pass when happy to proceed with work(s) (Any issues please comment below)",,,
"checkpoint-group",,"","section","Bathroom 1"
"checkpoint-status",,"","checkpoint","Install WC, Connect Water & Clean Silicone (If Needed) - Tighten Flexis"
"checkpoint-status",,"","checkpoint","Flush Toilet 5 Times & check for leaks behind hob (CHECK WATER LEVEL)"
"checkpoint-status",,"","checkpoint","Hand Basin Installed (As per Below)"
"button","43aa326d-9ef6-416d-b9b1-5cd2f779e50d","","button","Square & Level","Yes, No",,
"button","e85b4b27-c41e-4399-84d4-df803964be50","","button","Vanity Opens & Shuts fine/NO scratches","Yes, No",,
"button","00a7bd67-9129-42e6-ac67-e9f1f5895d25","","button","Basin Mixer (SOLID)","Yes, No",,
"button","4bf26c04-6e11-4000-8df8-caea08f69723","","button","Water Turned ON & Flexi's Checked for Leaks Then Re-tightened","Yes, No",,
"checkpoint-status",,"","checkpoint","Waste connected (FILL & TEST BOWL). CHECK NO LEAKS"
"button","d307c004-c732-493a-8fc6-fd3730f1f19f","","button","Cover Plates Installed","Yes, No",,
"checkpoint-status",,"","checkpoint","Seal Shower mixer & Install Flange"
