"Rich Type","Id","Warnings","type","name","values","prefix","postfix","Usage Count","User Addable","Template Name","Template Id"
"checkpoint-status",,"","checkpoint","Shower Rose rail (Run Water & Clean Filter) - Collect hoses & heads"
"checkpoint-status",,"","checkpoint","Bath Installed (As per Below)"
"button","d471a548-8e13-40d4-8b05-2989ec69f6b5","","button","Bath Fill Tested & Water Run Test Completed","Yes, No",,
"button","1a2e212d-ca21-4324-8938-855f3150f949","","button","Bath Spout & Mixer Handle Tested - Clean Water","Yes, No",,
"button","58ee75a4-3327-4cbd-a45a-00376dd40cc3","","button","Protection Installed (Attach Photos)","Yes, No",,
"checkpoint-status",,"","checkpoint","Test Shower FW & Main FW - Clean Out (Attach Photos)"
"checkpoint-status",,"","checkpoint","Install Shower Hose on Rail"
"checkpoint-status",,"","checkpoint","Clean aerator, Remove Trap & Clean Out (Tighten Trap) & Test Floor Waste - Clean Out"
"checkpoint-status",,"","checkpoint","Final - Pass when Bathroom work(s) complete (Any issues please comment below)"
"checkpoint-group",,"","section","Balcony Drain"
"checkpoint-status",,"","checkpoint","Clear RWO"
"checkpoint-status",,"","checkpoint","Check Gas Bayonet for Leaks & Installed Correctly"
"checkpoint-status",,"","checkpoint","Check Hose Tap for Leaks & Installed Correctly"
"checkpoint-status",,"","checkpoint","Final - Pass when Balcony work(s) complete (Any issues please comment below)"
"checkpoint-group",,"","section","Handover"
"checkpoint-status",,"","checkpoint","FINAL HANDOVER HOLDPOINT - All Commissioning QA completed to specification/drawings & Area(s) left clean/tidy"
"label","179d5931-75c1-49c4-8f89-0c0f6b01379d","","label","FINAL - Pass when happy to proceed with work(s) (Any issues please comment below)",,,

"checklist-sectioned",,"","checklist","",,,,40,"No",,"50975d065dde46d3fe51f61a63b3a535fc6206218b89157507e486fd1670ee2a"
"checkpoint-group",,"","section","Room Aerial Drainage Installation"
"checkpoint-status",,"","checkpoint","Workshop Drawings for construction & approved"
"text","4d5508cf-a9c1-4510-8bd3-b4c3eace0b83","","text","Hydraulic Drawing & revision number(s)",,,
"checkpoint-status",,"","checkpoint","Check scope of works/specification & ensure all documents are current"
"checkpoint-status",,"","checkpoint","Check for any purchaser upgrades & ensure required changes are installed if approved"
"checkpoint-status",,"","checkpoint","Fire collars cleared of concrete slurry & logged to Firedoc"
"checkpoint-status",,"","checkpoint","Approved Material delivered to site and stored/ secured safely"
"checkpoint-status",,"","checkpoint","Sewer services installed correctly as per workshop drawings"
"checkpoint-status",,"","checkpoint","Stormwater services installed correctly as per workshop drawings"
"checkpoint-status",,"","checkpoint","Drainage risers and vent riser services installed correctly as per workshop drawings and schematics		"
"label","3f557bb4-b6ab-4a14-83e2-2c0fcfad7b92","","label","Minimum Grades installed as per AS3500",,,
"button","cb10b91c-8b7f-4da8-a7c3-249a66a2d2ef","","button","Bracketing installed as per AS3500 and manufacturers specifications","Yes, No, N/A",,
"button","7db32d47-84f9-4443-9583-40cbf5045989","","button","Sufficient IO's installed for compliance and maintenance requirements","Yes, No, N/A",,
"button","797809f4-502d-49a4-b54a-07912ea0f77c","","button","Pink primer and Blue glue used only on UPVC","Yes, No, N/A",,
"checkpoint-status",,"","checkpoint","Hydrostatic test filled with water to a height not less than 1m above soffit level of highest pipe for a minimum of 15min"
"checkpoint-status",,"","checkpoint","Correct fire collars installed with test reports on file. Retro fit floor waste collars installed"
"button","4bae5cc6-9586-4950-80fd-15bbe3e7358f","","button","Fire penetration stickers installed and photographed","Yes, No, N/A",,
"button","dd6ec1d0-d09c-4dec-b6ce-a8135a48c2f9","","button","Smoke seal all penetrations","Yes, No, N/A",,
"checkpoint-status",,"","checkpoint","Pipes labelled as per AS3500"
"checkpoint-status",,"","checkpoint","Co-ordination with walls and other services overviewed and co-ordinated onsite"
"checkpoint-status",,"","checkpoint","Acoustic lagging as per project requirements"
"checkpoint-status",,"","checkpoint","Sponges installed in Floor wastes"
"checkpoint-status",,"","checkpoint","All points capped off to ensure no builders debri enters system"
"checkpoint-status",,"","checkpoint","Update Asbuilt drawing immediately"
"text","cff781d7-52a4-4168-b20e-2a5f7f94f19d","","text","Confirm IL of pipework",,,
"checkpoint-status",,"","checkpoint","Clean up & excess material stored away"
"checkpoint-status",,"","checkpoint","All Drainage works completed to specification/drawings & Area left clean/tidy"
"label","1a3c0c44-7256-4fac-b7d4-9b78dcdea8d6","","label","Pictures of works completed - Attached below",,,
"boolean","2f58ca19-1301-464b-8122-b57896791076","","bool","Builder's Signature added below",,,
"boolean","9a865b22-91f8-44e1-bce1-64ff0c482aae","","bool","Plumbers Signature added below",,,
"label","636d169e-af75-42af-985b-9221935a7590","","label","FINAL - Pass when happy to proceed with work(s) (Any issues please comment below)",,,
"holdpoint",,"","holdpoint","Click to Add Plumber & Builders Signatures (If applicable)"
"checkpoint-group",,"","section","Room Rough-in Pressure Services Installation"
"checkpoint-status",,"","checkpoint","Workshop Drawings for construction & approved"
"text","51bdf6c3-86b5-4721-b53d-de228474f23e","","text","Hydraulic Drawing & revision number(s)",,,
"checkpoint-status",,"","checkpoint","Check scope of works/specification & ensure all documents are current"
"checkpoint-status",,"","checkpoint","Check for any purchaser upgrades & ensure required changes are installed if approved"
"checkpoint-status",,"","checkpoint","Bathroom setout off current Architectural drawings"
"checkpoint-status",,"","checkpoint","Approved Material delivered to site and stored/ secured safely"
"checkpoint-status",,"","checkpoint","Cold water services installed correctly as per workshop drawings"
"checkpoint-status",,"","checkpoint","Fridge points installed for 3 & 4 bed apartments only"
"checkpoint-status",,"","checkpoint","Hot/ Warm water services installed correctly as per workshop drawings"
"checkpoint-status",,"","checkpoint","HOLD POINT - NPCW services installed correctly as per workshop drawings and schematics"
"button","8d328fb3-8e1f-473b-b0a5-73a0cf5dcff3","","button","Ensure NPCW pipework is installed and spaced as per requirements of Australian Standards and Fair Trading","Yes, No, N/A",,
"button","5846168d-12f1-461c-8419-e93f58e7ded6","","button","Department of Fair Trading inspection for recycled water services","Yes, No, N/A",,
"checkpoint-status",,"","checkpoint","Bracketing installed as per AS3500 and manufacturers specifications"
"button","5f2e2082-ca22-4a1d-a9d0-38181b822a01","","button","Check for any cross connections","Yes, No",,
"button","5748c87b-7f54-4245-bae2-9b2c34faf24c","","button","Grommets through studs and silicon where pipes cross","Yes, No, N/A",,
"checkpoint-status",,"","checkpoint","Basin wastes and toilet waste offset and tested with water if required"
"checkpoint-status",,"","checkpoint","Internal cistern installed and tested. Ensure cistern is installed as far forward"
"checkpoint-status",,"","checkpoint","Inwall mixers installed and tested. Ensure Mixer is installed as far forward"
"checkpoint-status",,"","checkpoint","Loop re-runs to be fire rated, labelled and photographed"
"checkpoint-status",,"","checkpoint","All setouts ok and run eyes over crimps"
"checkpoint-status",,"","checkpoint","Smoke seal any pex pipe going into meter cupboard."
"checkpoint-status",,"","checkpoint","Hydrostatic test filled with water and pumped @ 1000kpa. Ensure shower mixers are off and test the shower head on its own"
"text","b8020354-bc9d-43dc-b622-67b0fd70fcc7","","text","Record start time and stop time and provide photo evidence of gauge",,,
"checkpoint-status",,"","checkpoint","Leave all services under pressure while apartment is being finished"
"button","4099f3b0-d9c2-4a25-a20b-c4b522a9c379","","button","Correct fire collars installed with Firedoc logging","Yes, No",,
"button","c70e15d2-bd72-41df-81c2-46a4d5d1628a","","button","Fire penetration stickers installed and photographed","Yes, No",,
"checkpoint-status",,"","checkpoint","Pipes labelled as per AS3500"
"checkpoint-status",,"","checkpoint","Coordination with walls and other services overviewed and coordinated onsite"
"checkpoint-status",,"","checkpoint","Thermal lagging as per project requirements"
"checkpoint-status",,"","checkpoint","Clean up & excess material stored away"
"checkpoint-status",,"","checkpoint","All Rough-In works completed to specification/drawings & Area left clean/tidy"
"label","53705c8f-f3df-46dc-bbc3-7ba31b091660","","label","Pictures of works completed - Attached below",,,
"boolean","a7028c53-576e-4cdf-8e54-299874f317ee","","bool","Builder's Signature added below",,,
"boolean","a9ed6772-4e59-47ce-94db-cf37b76ed86f","","bool","Plumbers Signature added below",,,
"label","78c5b6e0-e457-44aa-9389-40bc1b74ff46","","label","FINAL - Pass when happy to proceed with work(s) (Any issues please comment below)",,,
"holdpoint",,"","holdpoint","Click to Add Plumber & Builders Signatures (If applicable)"
"checkpoint-group",,"","section","Final Fit-Off Services Installation"
"checkpoint-status",,"","checkpoint","Workshop Drawings for construction & approved"
"text","e46824d1-74b3-4c76-9cb4-adbab9bdef69","","text","Hydraulic Drawing & revision number(s)",,,
"checkpoint-status",,"","checkpoint","Check scope of works/specification & ensure all documents are current"
"checkpoint-status",,"","checkpoint","Check for any purchaser upgrades & ensure required changes are installed if approved"
"checkpoint-status",,"","checkpoint","Bathroom setout off current Architectural drawings"
"checkpoint-status",,"","checkpoint","Approved Material delivered to site and stored/ secured safely"
"checkpoint-status",,"","checkpoint","Install WC, Connect Water & Clean Silicon (If Needed) & Tighten Flexis"
"checkpoint-status",,"","checkpoint","Flush Toilet 3 Times (check water level and leaks)"
"checkpoint-status",,"","checkpoint","Ensure mini cock is not blocked with lockseal"
"checkpoint-status",,"","checkpoint","Hand Basin & Mixer Installation (SOLID) , ensure cover plates are installed


"
"checkpoint-status",,"","checkpoint","Vanity opening and shutting fine/ no scratches"
"button","f9fb2f7b-1836-47e6-a04c-755a5723b8e0","","button","Connect Waste (FILL & TEST BOWL)","Yes, No, N/A",,
"button","d77bb31c-d426-4e7c-97d3-1ea2c3579436","","button","Remove Trap & Clean Out (Tighten Trap) and  Check Flexi's For Leaks & Tighten","Yes, No, N/A",,
"button","98e10148-a0ec-488d-86f0-91f0a59eee16","","button","Basin water working (Clean Aerator)","Yes, No, N/A",,
"checkpoint-status",,"","checkpoint","Seal Shower Mixer & Install Flange"
"button","a105e3d8-61dc-4779-99d1-7f8d505fcdef","","button","Shower Rose (Run Water & Clean Filter)","Yes, No, N/A",,
"button","41304fbe-83d2-4390-8104-a947df01af6f","","button","Test Shower FW & Main FW - Clean Out","Yes, No, N/A",,
"button","c27bee1d-60f0-4043-b974-4ce5b33f5d6c","","button","Install shower hose on rail


","Yes, No, N/A",,
"checkpoint-status",,"","checkpoint","Clean up & excess material stored away"
"checkpoint-status",,"","checkpoint","Fit-Off works completed to specification/drawings & Area left clean/tidy"
"label","f9f599f4-c06f-4183-ade4-f712016a81b3","","label","Pictures of works completed - Attached below",,,
"boolean","b7359bdc-7f9b-4c68-b179-143febe6f913","","bool","Builder's Signature added below",,,
"boolean","89c726dd-0f6e-4af9-9136-4ce6e5a1df21","","bool","Plumbers Signature added below",,,
"label","575c582b-0ad0-4991-99dd-88619dff38b3","","label","FINAL - Pass when happy to proceed with work(s) (Any issues please comment below)",,,
"holdpoint",,"","holdpoint","Click to Add Plumber & Builders Signatures (If applicable)"

"checklist-sectioned",,"","checklist","",,,,1,"No",,"6e02e8552f9798dabdcbbbf6d4a632786023185d61def7d1fc8f55e9cc2044e3"
"checkpoint-group",,"","section","Kitchen"
"checkpoint-status",,"","checkpoint","Kitchen Sink & Mixer (SOLID)"
"checkpoint-status",,"","checkpoint","Remove Trap & Clean Out (Tighten Trap)"
"checkpoint-status",,"","checkpoint","Sink Connected - Run water & fill tub to rim (Check for Leaks)"
"checkpoint-status",,"","checkpoint","Tighten Water Flexis, Clean Aerator"
"checkpoint-status",,"","checkpoint","Dishwasher Installed as per below"
"button","1421d58a-78ab-4884-9450-2e90d96c8cf5","","button","Lead plugged in & water left off until permanent power is on","Yes, No",,
"button","8af1479c-f486-412b-b778-f76005c7791a","","button","Dishwasher Hoses neat at the back of Cupboard & cover plates installed","Yes, No",,
"checkpoint-status",,"","checkpoint","Check Drawings to see if AAV is required"
"button","80b7c6cf-f58f-4610-b9f0-70d07f5a2e72","","button","If AAV is required, is it installed","Yes, No",,
"checkpoint-status",,"","checkpoint","Install & Connect Cook Top (Check Silicon, clipping & Gas Connection)"
"checkpoint-status",,"","checkpoint","Protection Installed (Attach Photos)"
"checkpoint-status",,"","checkpoint","FULL Dishwasher cycle run once permanent power is on. (Leave the power on)"
"checkpoint-status",,"","checkpoint","Purge Gas on balcony or internally with doors open, Ignite Cook Top & Test"
"checkpoint-status",,"","checkpoint","Hot Water timed to unit"
"text","c87d7591-0d97-4f43-be4e-d85d7e85bdd1","","text","Time",,,
"checkpoint-status",,"","checkpoint","Final - Pass when Kitchen work(s) complete (Any issues please comment below)"
"checkpoint-group",,"","section","Bathroom 1"
"checkpoint-status",,"","checkpoint","Install WC, Connect Water & Clean Silicone (If Needed) - Tighten Flexis"
"checkpoint-status",,"","checkpoint","Flush Toilet 5 Times & check for leaks behind hob (CHECK WATER LEVEL)"
"checkpoint-status",,"","checkpoint","Hand Basin Installed (As per Below)"
"button","43aa326d-9ef6-416d-b9b1-5cd2f779e50d","","button","Square & Level","Yes, No",,
"button","e85b4b27-c41e-4399-84d4-df803964be50","","button","Vanity Opens & Shuts fine/NO scratches","Yes, No",,
"button","00a7bd67-9129-42e6-ac67-e9f1f5895d25","","button","Basin Mixer (SOLID)","Yes, No",,
"button","4bf26c04-6e11-4000-8df8-caea08f69723","","button","Water Turned ON & Flexi's Checked for Leaks Then Re-tightened","Yes, No",,
"checkpoint-status",,"","checkpoint","Waste connected (FILL & TEST BOWL). CHECK NO LEAKS"
"button","d307c004-c732-493a-8fc6-fd3730f1f19f","","button","Cover Plates Installed","Yes, No",,
"checkpoint-status",,"","checkpoint","Seal Shower mixer & Install Flange"
"checkpoint-status",,"","checkpoint","Shower Rose rail (Run Water & Clean Filter) - Collect hoses & heads"
"checkpoint-status",,"","checkpoint","Bath Installed (As per Below)"
"button","d471a548-8e13-40d4-8b05-2989ec69f6b5","","button","Bath Fill Tested & Water Run Test Completed","Yes, No",,
"button","1a2e212d-ca21-4324-8938-855f3150f949","","button","Bath Spout & Mixer Handle Tested - Clean Water","Yes, No",,
"button","58ee75a4-3327-4cbd-a45a-00376dd40cc3","","button","Protection Installed (Attach Photos)","Yes, No",,
"checkpoint-status",,"","checkpoint","Test Shower FW & Main FW - Clean Out (Attach Photos)"
"checkpoint-status",,"","checkpoint","Install Shower Hose on Rail"
"checkpoint-status",,"","checkpoint","Clean aerator, Remove Trap & Clean Out (Tighten Trap) & Test Floor Waste - Clean Out"
"checkpoint-status",,"","checkpoint","Final - Pass when Bathroom work(s) complete (Any issues please comment below)"
"checkpoint-group",,"","section","Balcony Drain"
"checkpoint-status",,"","checkpoint","Clear RWO"
"checkpoint-status",,"","checkpoint","Check Gas Bayonet for Leaks & Installed Correctly"
"checkpoint-status",,"","checkpoint","Check Hose Tap for Leaks & Installed Correctly"
"checkpoint-status",,"","checkpoint","Final - Pass when Balcony work(s) complete (Any issues please comment below)"
"checkpoint-group",,"","section","Handover"
"checkpoint-status",,"","checkpoint","FINAL HANDOVER HOLDPOINT - All Commissioning QA completed to specification/drawings & Area(s) left clean/tidy"
"label","179d5931-75c1-49c4-8f89-0c0f6b01379d","","label","FINAL - Pass when happy to proceed with work(s) (Any issues please comment below)",,,

"checklist-sectioned",,"","checklist","",,,,17,"No",,"1f7cd42699ebb51e4fd79b3696cb01ef0d68ec3f62c45c30aef225de8aa80fdc"
"checkpoint-group",,"","section","Prestart"
"checkpoint-status",,"","checkpoint","Latest consented drawings checked & referenced"
"text","2bd7ba1b-484d-434a-aabf-99f8df35e87c","","text","Drawing & revision number(s)",,,
"checkpoint-status",,"","checkpoint","Work area accessible & acceptable"
"label","4c3af574-3d3a-4576-ad6c-5d64fd76bd8b","","label","FINAL - Pass when happy to proceed with work(s) (Any issues please comment below)",,,
"checkpoint-group",,"","section","Kitchen"
"checkpoint-status",,"","checkpoint","Kitchen Sink & Mixer (SOLID)"
"checkpoint-status",,"","checkpoint","Remove Trap & Clean Out (Tighten Trap)"
"checkpoint-status",,"","checkpoint","Sink Connected - Run water & fill tub to rim (Check for Leaks)"
"checkpoint-status",,"","checkpoint","Tighten Water Flexis, Clean Aerator"
"checkpoint-status",,"","checkpoint","Dishwasher Installed as per below"
"button","1421d58a-78ab-4884-9450-2e90d96c8cf5","","button","Lead plugged in & water left off until permanent power is on","Yes, No",,
"button","8af1479c-f486-412b-b778-f76005c7791a","","button","Dishwasher Hoses neat at the back of Cupboard & cover plates installed","Yes, No",,
"checkpoint-status",,"","checkpoint","Check Drawings to see if AAV is required"
"button","80b7c6cf-f58f-4610-b9f0-70d07f5a2e72","","button","If AAV is required, is it installed","Yes, No",,
"checkpoint-status",,"","checkpoint","Install & Connect Cook Top (Check Silicon, clipping & Gas Connection)"
"checkpoint-status",,"","checkpoint","Protection Installed (Attach Photos)"
"checkpoint-status",,"","checkpoint","FULL Dishwasher cycle run once permanent power is on. (Leave the power on)"
"checkpoint-status",,"","checkpoint","Purge Gas on balcony or internally with doors open, Ignite Cook Top & Test"
"checkpoint-status",,"","checkpoint","Hot Water timed to unit"
"text","c87d7591-0d97-4f43-be4e-d85d7e85bdd1","","text","Time",,,
"checkpoint-status",,"","checkpoint","Final - Pass when Kitchen work(s) complete (Any issues please comment below)"
"checkpoint-group",,"","section","Bathroom 1"
"checkpoint-status",,"","checkpoint","Install WC, Connect Water & Clean Silicone (If Needed) - Tighten Flexis"
"checkpoint-status",,"","checkpoint","Flush Toilet 5 Times & check for leaks behind hob (CHECK WATER LEVEL)"
"checkpoint-status",,"","checkpoint","Hand Basin Installed (As per Below)"
"button","43aa326d-9ef6-416d-b9b1-5cd2f779e50d","","button","Square & Level","Yes, No",,
"button","e85b4b27-c41e-4399-84d4-df803964be50","","button","Vanity Opens & Shuts fine/NO scratches","Yes, No",,
"button","00a7bd67-9129-42e6-ac67-e9f1f5895d25","","button","Basin Mixer (SOLID)","Yes, No",,
"button","4bf26c04-6e11-4000-8df8-caea08f69723","","button","Water Turned ON & Flexi's Checked for Leaks Then Re-tightened","Yes, No",,
"checkpoint-status",,"","checkpoint","Waste connected (FILL & TEST BOWL). CHECK NO LEAKS"
"button","d307c004-c732-493a-8fc6-fd3730f1f19f","","button","Cover Plates Installed","Yes, No",,
"checkpoint-status",,"","checkpoint","Seal Shower mixer & Install Flange"
"checkpoint-status",,"","checkpoint","Shower Rose rail (Run Water & Clean Filter) - Collect hoses & heads"
"checkpoint-status",,"","checkpoint","Bath Installed (As per Below)"
"button","d471a548-8e13-40d4-8b05-2989ec69f6b5","","button","Bath Fill Tested & Water Run Test Completed","Yes, No",,
"button","1a2e212d-ca21-4324-8938-855f3150f949","","button","Bath Spout & Mixer Handle Tested - Clean Water","Yes, No",,
"button","58ee75a4-3327-4cbd-a45a-00376dd40cc3","","button","Protection Installed (Attach Photos)","Yes, No",,
"checkpoint-status",,"","checkpoint","Test Shower FW & Main FW - Clean Out (Attach Photos)"
"checkpoint-status",,"","checkpoint","Install Shower Hose on Rail"
"checkpoint-status",,"","checkpoint","Clean aerator, Remove Trap & Clean Out (Tighten Trap) & Test Floor Waste - Clean Out"
"checkpoint-status",,"","checkpoint","Final - Pass when Bathroom work(s) complete (Any issues please comment below)"
"checkpoint-group",,"","section","Balcony Drain"
"checkpoint-status",,"","checkpoint","Clear RWO"
"checkpoint-status",,"","checkpoint","Check Gas Bayonet for Leaks & Installed Correctly"
"checkpoint-status",,"","checkpoint","Check Hose Tap for Leaks & Installed Correctly"
"checkpoint-status",,"","checkpoint","Final - Pass when Balcony work(s) complete (Any issues please comment below)"
"checkpoint-group",,"","section","Handover"
"checkpoint-status",,"","checkpoint","FINAL HANDOVER HOLDPOINT - All Commissioning QA completed to specification/drawings & Area(s) left clean/tidy"
"label","179d5931-75c1-49c4-8f89-0c0f6b01379d","","label","FINAL - Pass when happy to proceed with work(s) (Any issues please comment below)",,,

"checklist-sectioned",,"","checklist","",,,,22,"No",,"2dee309182b04e47c18f48b843482c49639b741af0b688f186ce234b18c0e55a"
"checkpoint-group",,"","section","Prestart"
"checkpoint-status",,"","checkpoint","Latest consented drawings checked & referenced"
"text","2bd7ba1b-484d-434a-aabf-99f8df35e87c","","text","Drawing & revision number(s)",,,
"checkpoint-status",,"","checkpoint","Work area accessible & acceptable"
"label","4c3af574-3d3a-4576-ad6c-5d64fd76bd8b","","label","FINAL - Pass when happy to proceed with work(s) (Any issues please comment below)",,,
"checkpoint-group",,"","section","Kitchen"
"checkpoint-status",,"","checkpoint","Kitchen Sink & Mixer (SOLID)"
"checkpoint-status",,"","checkpoint","Remove Trap & Clean Out (Tighten Trap)"
"checkpoint-status",,"","checkpoint","Sink Connected - Run water & fill tub to rim (Check for Leaks)"
"checkpoint-status",,"","checkpoint","Tighten Water Flexis, Clean Aerator"
"checkpoint-status",,"","checkpoint","Dishwasher Installed as per below"
"button","1421d58a-78ab-4884-9450-2e90d96c8cf5","","button","Lead plugged in & water left off until permanent power is on","Yes, No",,
"button","8af1479c-f486-412b-b778-f76005c7791a","","button","Dishwasher Hoses neat at the back of Cupboard & cover plates installed","Yes, No",,
"checkpoint-status",,"","checkpoint","Check Drawings to see if AAV is required"
"button","80b7c6cf-f58f-4610-b9f0-70d07f5a2e72","","button","If AAV is required, is it installed","Yes, No",,
"checkpoint-status",,"","checkpoint","Install & Connect Cook Top (Check Silicon, clipping & Gas Connection)"
"checkpoint-status",,"","checkpoint","Protection Installed (Attach Photos)"
"checkpoint-status",,"","checkpoint","FULL Dishwasher cycle run once permanent power is on. (Leave the power on)"
"checkpoint-status",,"","checkpoint","Purge Gas on balcony or internally with doors open, Ignite Cook Top & Test"
"checkpoint-status",,"","checkpoint","Hot Water timed to unit"
"text","c87d7591-0d97-4f43-be4e-d85d7e85bdd1","","text","Time",,,
"checkpoint-status",,"","checkpoint","Final - Pass when Kitchen work(s) complete (Any issues please comment below)"
"checkpoint-group",,"","section","Bathroom 1"
"checkpoint-status",,"","checkpoint","Install WC, Connect Water & Clean Silicone (If Needed) - Tighten Flexis"
"checkpoint-status",,"","checkpoint","Flush Toilet 5 Times & check for leaks behind hob (CHECK WATER LEVEL)"
"checkpoint-status",,"","checkpoint","Hand Basin Installed (As per Below)"
"button","43aa326d-9ef6-416d-b9b1-5cd2f779e50d","","button","Square & Level","Yes, No",,
"button","e85b4b27-c41e-4399-84d4-df803964be50","","button","Vanity Opens & Shuts fine/NO scratches","Yes, No",,
"button","00a7bd67-9129-42e6-ac67-e9f1f5895d25","","button","Basin Mixer (SOLID)","Yes, No",,
"button","4bf26c04-6e11-4000-8df8-caea08f69723","","button","Water Turned ON & Flexi's Checked for Leaks Then Re-tightened","Yes, No",,
"checkpoint-status",,"","checkpoint","Waste connected (FILL & TEST BOWL). CHECK NO LEAKS"
"button","d307c004-c732-493a-8fc6-fd3730f1f19f","","button","Cover Plates Installed","Yes, No",,
"checkpoint-status",,"","checkpoint","Seal Shower mixer & Install Flange"
"checkpoint-status",,"","checkpoint","Shower Rose rail (Run Water & Clean Filter) - Collect hoses & heads"
"checkpoint-status",,"","checkpoint","Bath Installed (As per Below)"
"button","d471a548-8e13-40d4-8b05-2989ec69f6b5","","button","Bath Fill Tested & Water Run Test Completed","Yes, No",,
"button","1a2e212d-ca21-4324-8938-855f3150f949","","button","Bath Spout & Mixer Handle Tested - Clean Water","Yes, No",,
"button","58ee75a4-3327-4cbd-a45a-00376dd40cc3","","button","Protection Installed (Attach Photos)","Yes, No",,
"checkpoint-status",,"","checkpoint","Test Shower FW & Main FW - Clean Out (Attach Photos)"
"checkpoint-status",,"","checkpoint","Install Shower Hose on Rail"
"checkpoint-status",,"","checkpoint","Clean aerator, Remove Trap & Clean Out (Tighten Trap) & Test Floor Waste - Clean Out"
"checkpoint-status",,"","checkpoint","Final - Pass when Bathroom work(s) complete (Any issues please comment below)"
"checkpoint-group",,"","section","Handover"
"checkpoint-status",,"","checkpoint","FINAL HANDOVER HOLDPOINT - All Commissioning QA completed to specification/drawings & Area(s) left clean/tidy"
"label","179d5931-75c1-49c4-8f89-0c0f6b01379d","","label","FINAL - Pass when happy to proceed with work(s) (Any issues please comment below)",,,

"checklist-sectioned",,"","checklist","",,,,2,"No",,"d3a11944b7df2dfd7b358af1c959edcdc26660bd70909d66d1012a14f9f3b5bd"
"checkpoint-group",,"","section","Prestart"
"checkpoint-status",,"","checkpoint","Latest consented drawings checked & referenced"
