"Rich Type","Id","Warnings","type","name","values","prefix","postfix","Usage Count","User Addable","Template Name","Template Id"
"checklist-flat",,"","checklist","Job Details",,,,1,"Yes","Add Job Details","004ee347-63e1-4e12-afe5-a797a4ce87b1"
"checkpoint-no-status",,"","checkpoint","Site Info"
"text","36e33acc-66c5-4306-a3f9-d5b9d88dbd12","","text","Site Address",,,
"text","4a94e221-c4dd-4603-84ee-7e330f63bde0","","text","Builders Details",,,
"text","bb24ac29-ee9c-4053-be93-cca8d6ad6b5e","","text","Project Managers Details",,,
"text","8f33d3fc-f155-4bee-8850-cf61ab452133","","text","Site Managers Details",,,
"checkpoint-no-status",,"","checkpoint","latest drawings (attached or referenced)"
"checkpoint-no-status",,"","checkpoint","Scope of Works Attached"
"checkpoint-no-status",,"","checkpoint","Additional Pre-Start Docs (attached or referenced)"

"checklist-flat",,"","checklist","Variation",,,,0,"Yes","Add Variation","40920a37-9d73-41cc-b77f-8db5df167b4c"
"checkpoint-status",,"","checkpoint","Variation Details Approved"
"text","06874631-61de-4499-9a8f-461ebfc88c17","","text","Reference/Drawing/Instruction Number",,,
"text","034cf58f-1b63-4c71-a3b6-f632ec539b7e","","text","Variation Area",,,
"text","459b3020-57c7-476e-ac5c-5d22cccace41","","text","Materials & labour breakdown (Names, Hours & Material(s)/Quantities)",,,
"checkpoint-status",,"","checkpoint","Variation Completed"
"label","c8b9fd8d-4b9c-45f0-b7cb-c2f7e0372889","","label","Once variation information is completed - Please SEND report to Ryman",,,

"checklist-flat",,"","checklist","Monthly Checks ITP V.050221",,,,0,"Yes","Add Monthly Checks ITP V.050221","9117be79-2790-4432-82aa-1b09c57d002c"
"checkpoint-status",,"","checkpoint","Check scope of work(s)/Specification & ensure all documents are current (Any issues comment below)"
"checkpoint-status",,"","checkpoint","Water connection complete & emergency shut off inplace"
"checkpoint-status",,"","checkpoint","Temp sewer pumps installed & checked"
"checkpoint-status",,"","checkpoint","Temp Stormwater pumps installed checked"
"checkpoint-status",,"","checkpoint","Latest revised plans on site"
"text","888c6dbd-4a07-4602-a627-90805bc29409","","text","Tool count - Photos/comments added below",,,
"button","ebaaa7c9-5bd4-4de9-9851-b661fbcdaa88","","button","All tool electrical tags completed - Any not tagged listed/photographed below","Yes, No",,
"checkpoint-status",,"","checkpoint","All tools calibrated. CRIMPERS AND COPPER/ STAINLESS  PRESS"
"checkpoint-status",,"","checkpoint","Up to date price list"
"checkpoint-status",,"","checkpoint","Drains protected"
"checkpoint-status",,"","checkpoint","Temps services maintained"
"checkpoint-status",,"","checkpoint","Site compound tidy"
"checkpoint-status",,"","checkpoint","Monthly safety checks completed & daily/weekly sheets compiled"
"checkpoint-status",,"","checkpoint","All ITP's & QA checklist complete"
"checkpoint-status",,"","checkpoint","Cold water pressure pump installed on 150mm high concrete plinths"
"label","229fccd0-fab5-44d1-9e44-06be31ca2b9d","","label","PUMPS ONLY COMMISSIONED BY PUMP SUPPLIER",,,
"button","c46d3030-e00d-4c3c-bea6-dcb51572b276","","button","Fibre gaskets on pumps only","Yes, No, N/A",,
"button","87f2ac2e-566a-4396-b570-f098bb6dd168","","button","Flange nuts & bolts tightened","Yes, No",,
"checkpoint-status",,"","checkpoint","Basket traps installed in garbage rooms"
"checkpoint-status",,"","checkpoint","Hot water heaters installed in garbage rooms"
"checkpoint-status",,"","checkpoint","Hose taps installed in garbage rooms"
"checkpoint-status",,"","checkpoint","Tundish points installed for hot water & mech"
"checkpoint-status",,"","checkpoint","Quality assurance checking of all workmanship"
"checkpoint-status",,"","checkpoint","All employees on site with appropriate PPE"
"checkpoint-status",,"","checkpoint","Excess material on site no longer required removed"
"checkpoint-status",,"","checkpoint","All Monthly Checks completed"
"boolean","b18e10af-c08d-48f7-8b1c-01232bc093ff","","bool","Builder's Signature added below",,,
"boolean","4048feb8-0449-4b60-92e0-dfde5b021145","","bool","Plumbers Signature added below",,,
"holdpoint",,"","holdpoint","Click to Add Plumber & Builders Signatures (If applicable)"

"checklist-sectioned",,"","checklist","",,,,2,"No",,"52dfd249af8b014c9931169a56308b66d4a3e24159e7667a98966b2ad9d3783f"
"checkpoint-group",,"","section","Prestart"
"checkpoint-status",,"","checkpoint","Workshop Drawings for construction & approved"
"text","61fd29c4-0ff4-4c4b-b9b2-5e834f7addfd","","text","Sewer - Hydraulic Drawing & revision number(s)",,,
"text","b3987cb6-12d5-4da1-81cd-ac7195d80bee","","text","Stormwater- Hydraulic Drawing & revision number(s)",,,
"checkpoint-status",,"","checkpoint","Check scope of works/specification & ensure all documents are current"
"label","a595ec03-7b6f-4b77-9f97-ee2963310a65","","label","Set out to be off current penetration drawing & Architectural GA & concrete setout plans",,,
"checkpoint-status",,"","checkpoint","Approved Material delivered to site & stored/ secured safely"
"checkpoint-status",,"","checkpoint","Work area accessible & acceptable"
"label","2cd00034-6cfa-419d-ae36-1d6d873027bd","","label","FINAL - Pass when happy to proceed with work(s) (Any issues please comment below)",,,
"checkpoint-group",,"","section","Sewer"
"checkpoint-status",,"","checkpoint","HDPE material for concrete over >65mpa as per specifications"
"label","29ceb753-5e09-48f0-ba38-cbc760672d0a","","label","UPVC pipe material for <65mpa as per specifications",,,
"checkpoint-status",,"","checkpoint","Sewer drainage installed as per workshop drawings"
"checkpoint-status",,"","checkpoint","Confirm workshop drawings & installation complies with AS3500"
"checkpoint-status",,"","checkpoint","Minimum Grades achieved 40-80mm 2.5%, 100mm 1.65%, 150mm 1.25%, 225mm 0.60% - As per Australian Standards"
"text","73d7af05-6eb3-4255-8ab2-5dc95543fa32","","text","Pipe Used & Grade Achieved",,,
"checkpoint-status",,"","checkpoint","Pipework risers labelled"
"button","607bc133-2cf3-40c7-a39b-6c37cb1c311e","","button","Bracketing on pipework installed as per AS3500","Yes, No, N/A",,
"button","62631d20-53f2-4b68-96a6-54e953bdf4d8","","button","Pink Primer & Blue glue to be used only on UPVC pipework","Yes, No, N/A",,
"button","7ecdf226-6a8a-4e06-8470-7073d7d367cf","","button","Check all electrofusion welds (HDPE) or glued joints (UPVC) for any faults","Yes, No, N/A",,
"checkpoint-status",,"","checkpoint","Hydrostatic test filled with water to a height not less than 1m above soffit level of highest pipe for a minimum of 15min"
"button","01ddf5bf-4554-4e16-a01a-9fe9a5ad4b34","","button","Wrap sewer pipework with approved material as per Australian Standards, Hydraulic Spec","Yes, No, N/A",,
"button","fb3169a9-285a-4546-af2c-8d7e1939d77e","","button","All pipe risers to be protected with pipe caps & or duck tape","Yes, No, N/A",,
"checkpoint-status",,"","checkpoint","HOLD POINT - Inspection by Fair Trading for sewer drainage to be done & other inspections if required by others"
"label","c6421dd4-904a-4416-b1b3-4fde3debfd3b","","label","Attach inspection reports below",,,
"checkpoint-status",,"","checkpoint","Backfill trenches with materials as per Australian standards & project requirements"
"label","0aca2b66-9110-4ee5-97d4-8bf238623a54","","label","Ensure compaction of fill materials is to specifications & Australian Standards",,,
"button","f0770d49-0b37-42d4-aa81-2432565ca4a4","","button","Compaction testing of trenches once backfilled to the Australian Standard requirements","Yes, No, N/A",,
"checkpoint-status",,"","checkpoint","All Sewer Work completed to specification/drawings & Area left clean/tidy & excess material stored away"
"label","33a52524-5da9-4c50-b766-9656c0a6d0f0","","label","FINAL - Pass when happy to proceed with work(s) (Any issues please comment below)",,,
"checkpoint-group",,"","section","Stormwater"
"checkpoint-status",,"","checkpoint","HDPE material for concrete over >65mpa as per specifications"
"label","cc6df4b7-bab4-4c84-bed3-5ea4c1f2bdf5","","label","UPVC pipe material for <65mpa as per specifications",,,
"checkpoint-status",,"","checkpoint","Stormwater drainage installed as per workshop drawings"
"checkpoint-status",,"","checkpoint","Installation of pits to the correct levels"
"button","7a0e213b-c9df-44d5-a42d-7c930d5c66a9","","button","Ensure correct grates & lids used with appropriate load ratings for locations to traffic movements","Yes, No, N/A",,
"button","93508d18-5192-4fa9-837a-77c7fb7afc76","","button","Pits to be sparged - Made water tight to inlet & outlet pipework","Yes, No, N/A",,
"button","7bb62d2f-0483-4ffc-9b76-3056914bd5c6","","button","Pits to have correct cross fall & benching as per Australian Standards","Yes, No, N/A",,
"checkpoint-status",,"","checkpoint","Confirm workshop drawings & installation complies with AS3500"
"checkpoint-status",,"","checkpoint","Minimum Grades achieved 40-80mm 2.5%, 100mm 1.65%, 150mm 1.25%, 225mm 0.60% - As per Australian Standards"
"text","570d5f76-afbf-4278-a51d-6c3052f06198","","text","Pipe Used & Grade Achieved",,,
"checkpoint-status",,"","checkpoint","Pipework risers labelled"
"button","ea9af228-b4d1-4d58-bf39-6af4b9d6bc67","","button","Bracketing on pipework installed as per AS3500","Yes, No, N/A",,
"button","4c8b8fb2-f347-47d3-8e4c-91460058251b","","button","Pink Primer & Blue glue to be used only on UPVC pipework","Yes, No, N/A",,
"button","85a02cda-4dc6-4a67-8a4e-f35ab638d920","","button","Check all electrofusion welds (HDPE) or glued joints (UPVC) for any faults","Yes, No, N/A",,
"checkpoint-status",,"","checkpoint","Hydrostatic test filled with water to a height not less than 1m above soffit level of highest pipe for a minimum of 15min"
"button","33172cba-945d-4939-a2bd-0990b496bae9","","button","Wrap stormwater pipework with approved material as per Australian Standards, Hydraulic Spec","Yes, No, N/A",,
"button","04aff34c-9795-40a8-bb13-32f7814b3a98","","button","All pipe risers to be protected with pipe caps & or duck tape","Yes, No, N/A",,
"checkpoint-status",,"","checkpoint","HOLD POINT - Inspections if required by relevant authorised persons"
"label","ee2ca063-df98-4b37-8bd7-81444c313d67","","label","Attach inspection reports below",,,
"checkpoint-status",,"","checkpoint","Backfill trenches with materials as per Australian standards & project requirements"
"label","00a8f205-a918-4a96-a1a2-1d071ccfc5c0","","label","Ensure compaction of fill materials is to specifications & Australian Standards",,,
"button","41ccab6b-94d5-4b00-9c97-f8bc8bc581dc","","button","Compaction testing of trenches once backfilled to the Australian Standard requirements","Yes, No, N/A",,
"checkpoint-status",,"","checkpoint","All Stormwater Work completed to specification/drawings & Area left clean/tidy & excess material stored away"
"label","4184e213-3d63-417a-bc4f-b54fc719353e","","label","FINAL - Pass when happy to proceed with work(s) (Any issues please comment below)",,,
"checkpoint-group",,"","section","Handover"
"checkpoint-status",,"","checkpoint","All pipes to be protected with pipe caps & or duck tape"
"checkpoint-status",,"","checkpoint","Update Asbuilt drawing immediately - Confirm IL of pipework. Attach with ITP submission"
"checkpoint-status",,"","checkpoint","CCTV completed pipework to ensure no defects before concrete pour to prevent future problems"
"checkpoint-status",,"","checkpoint","Ensure any pipework within concrete is full of water in the morning prior concrete pour"
"checkpoint-status",,"","checkpoint","Clean up & excess material stored away"
"checkpoint-status",,"","checkpoint","Pictures of works completed - Attached below"
"checkpoint-status",,"","checkpoint","All works completed, reviewed & approved - Signatures added below"
"text","cdc4a826-04a2-4042-a431-85713033e056","","text","Concrete pour date",,,
"boolean","f5b0ca62-283b-4aa5-8d7a-510744a467ec","","bool","Builder's Signature added below",,,
"boolean","2aec36f1-d58d-4a6a-a17d-0cc17548fd5c","","bool","Plumbers Signature added below",,,
"label","083637f2-85da-4cac-ad27-259c5f127aec","","label","FINAL - Pass when happy to proceed with work(s) (Any issues please comment below)",,,
"holdpoint",,"","holdpoint","Click to Add Plumber & Builders Signatures (If applicable)"

"checklist-flat",,"","checklist","",,,,10,"No",,"75e9f46220884689815d26c014ee1c7b296b9db29b9430f0a9aa1e9847290ec3"
"checkpoint-status",,"","checkpoint","Workshop Drawings issued for construction/ CO-ORDINATED & approved"
"text","76872591-2e8f-40ac-b0c1-e370c675a05a","","text","Hydraulic Drawing & revision number(s)",,,
"checkpoint-status",,"","checkpoint","Check scope of work(s)/Specification & ensure all documents are current (Any issues comment below)"
"label","fca2a7f8-52f6-4a72-a6c9-b67e47c0877c","","label","Set-out to be as per current Penetration/Architectural drawing(s)",,,
"checkpoint-status",,"","checkpoint","Approved Material(s) delivered to site & stored/secured safely"
"checkpoint-status",,"","checkpoint","Sewer services installed correctly as per workshop drawings"
"checkpoint-status",,"","checkpoint","Stormwater services installed correctly as per workshop drawings"
"checkpoint-status",,"","checkpoint","Tradewaste & vent services installed correctly as per workshop drawings"
"label","69ef4a04-d9f4-4ec9-8415-fed12bea40b7","","label","Minimum Grades installed as per AS3500",,,
"checkpoint-status",,"","checkpoint","Bracketing installed as per AS3500 & manufacturers specifications"
"checkpoint-status",,"","checkpoint","Sufficient IO's installed for compliance & Maintenance requirements"
"checkpoint-status",,"","checkpoint","Pink primer & blue glue used on UPVC pipes"
"checkpoint-status",,"","checkpoint","Check all electrofusion welds (HDPE) or glued joints (UPVC) for any faults"
"checkpoint-status",,"","checkpoint","Hydrostatic test filled with water to a height not less than 1m above soffit level of highest pipe for a minimum of 15min"
"checkpoint-status",,"","checkpoint","Correct fire collars installed with test reports on file (Attach if applicable)"
"button","22f7a777-3064-4aea-9ffb-01070ff1f0b3","","button","Fire Penetration stickers installed & Photographed (Attach below)","Yes, No",,
"button","5ac20751-5b24-4a69-9138-b174b647b541","","button","Smoke seal applied to all penetrations","Yes, No",,
"checkpoint-status",,"","checkpoint","Pipes labelled as per AS3500"
"checkpoint-status",,"","checkpoint","Co-ordination with walls/other services overviewed & co-ordinated onsite"
"checkpoint-status",,"","checkpoint","Acoustic lagging as per project requirements"
"checkpoint-status",,"","checkpoint","All points capped off to ensure no builders debris enters system"
"checkpoint-status",,"","checkpoint","Update Asbuilt drawings immediately"
"text","9426f5fc-88ae-44b1-919b-6eaba1b0c193","","text","Confirm IL of pipework",,,
"checkpoint-status",,"","checkpoint","All Aerial Drainage Work completed to specification/drawings & Area left clean/tidy"
"boolean","1332c1ba-7e78-4c14-87fc-24e96d06af4f","","bool","Builder's Signature added below",,,
"boolean","4487dfd7-a5a8-4a77-822a-a598c8d1875e","","bool","Plumbers Signature added below",,,
"label","48d12fa9-17c5-4b65-a5a6-31cc10532aff","","label","FINAL - Pass when happy to proceed with work(s) (Any issues please comment below)",,,
"holdpoint",,"","holdpoint","Click to Add Plumber & Builders Signatures (If applicable)"

"checklist-flat",,"","checklist","",,,,11,"No",,"c8e3fde3c88d9d7fc2276a608c7225d8279674f2c794e2e1117a3a44c58e3654"
"checkpoint-status",,"","checkpoint","Workshop Drawings issued for construction/ CO-ORDINATED & approved"
"text","43cf71d5-de87-4b67-b06e-9ad722f1f509","","text","Hydraulic Drawing & revision number(s)",,,
"text","f865d161-00cf-4f7f-9f33-cacb15f91334","","text","Schematic(s) Drawing & revision number(s)",,,
"checkpoint-status",,"","checkpoint","Check scope of work(s)/Specification & ensure all documents are current (Any issues comment below)"
"label","76487bea-bcf3-41ae-8a6e-c1c448fe784a","","label","Check working pressures & ensure material can cater for those pressures",,,
"checkpoint-status",,"","checkpoint","Approved Material(s) delivered to site & stored/secured safely"
"checkpoint-status",,"","checkpoint","Calibration of crimp tools & deburring machine onsite complete"
"checkpoint-status",,"","checkpoint","Cold water services installed correctly as per workshop drawings"
"checkpoint-status",,"","checkpoint","Gas services installed correctly as per workshop drawings"
"checkpoint-status",,"","checkpoint","Hot Water & vent services installed correctly as per workshop drawings"
"checkpoint-status",,"","checkpoint","NPCW/ Rainwater services installed correctly as per workshop drawings"
"label","5e9b225a-407c-408f-abdd-d1ad2ce141a2","","label","Ensure to keep separation between NPCW & other services as per Australian Standards",,,
"checkpoint-status",,"","checkpoint","HOLD POINT - Fair Trading inspections for installations of recycled water service if any"
"checkpoint-status",,"","checkpoint","Hydrant services installed correctly as per workshop drawings"
"checkpoint-status",,"","checkpoint","Bracketing installed as per AS3500 & manufacturers specifications"
"checkpoint-status",,"","checkpoint","Witness marks on all press fittings checked"
"label","5c013e42-fb07-4716-9bf8-e73f1c520045","","label","Grinders for cutting pipework prohibited",,,
"checkpoint-status",,"","checkpoint","Gal pipe grooves checked with a groove tape"
"checkpoint-status",,"","checkpoint","Pipe spacers installed to avoid electrofusion"
"checkpoint-status",,"","checkpoint","Water Services Pressure test completed"
"label","f7ee9c39-0473-4d35-8342-5707a1e349fe","","label","Tested @ 1500KPA or 1.5 x Working pressure. Whichever is higher for a minimum duration of 60 minutes",,,
"checkpoint-status",,"","checkpoint","Gas Services Pressure test completed"
"label","b86cc7c9-6c3e-4cae-a0bd-a0eb63d74658","","label","Tested @ 300KPA for a minimum of 60 minutes",,,
"checkpoint-status",,"","checkpoint","All services left under pressure during construction"
"button","fc8dc575-ef35-49ab-9c07-f4c597dabf2f","","button","Fire Penetration stickers installed & Photographed (Attach below)","Yes, No",,
"button","115eb416-59d4-4785-b5d4-6641fa0c64b2","","button","Smoke seal applied to all penetrations","Yes, No",,
"checkpoint-status",,"","checkpoint","Pipes labelled as per AS3500"
"checkpoint-status",,"","checkpoint","Co-ordination with walls/other services overviewed & co-ordinated onsite"
"checkpoint-status",,"","checkpoint","Thermal lagging as per project requirements & AS3500"
"checkpoint-status",,"","checkpoint","All points capped off to ensure no builders debris enters system"
"checkpoint-status",,"","checkpoint","Update Asbuilt drawings immediately"
"text","f309e5a3-1b43-4d76-b26b-19c48853d80f","","text","Confirm IL of pipework",,,
"checkpoint-status",,"","checkpoint","All Pressure Services work completed to specification/drawings & Area left clean/tidy"
"boolean","bb96fc50-d184-4e66-9c32-6f6267001e54","","bool","Builder's Signature added below",,,
"boolean","c8ddb3d4-c98b-4c2b-b141-59d565e52333","","bool","Plumbers Signature added below",,,
"label","98b597d3-0203-4f44-90c1-6a0501789a22","","label","FINAL - Pass when happy to proceed with work(s) (Any issues please comment below)",,,
"holdpoint",,"","holdpoint","Click to Add Plumber & Builders Signatures (If applicable)"

"checklist-sectioned",,"","checklist","",,,,10,"No",,"9cbb07baa3d58c35cb9ae3dc46b7566a574eed51bc7b62b1b1c65d08293ae006"
"checkpoint-group",,"","section","Prestart"
"checkpoint-status",,"","checkpoint","Workshop Drawings for construction issued & approved"
"text","4cbbb788-5dc8-4ac9-8f76-de83b2e59c8c","","text","Penetration Drawing & revision number(s)",,,
"text","e4edad20-a50f-431a-98f9-f8cb243d589b","","text","Hydraulic Drawing & revision number(s)",,,
"checkpoint-status",,"","checkpoint","Check scope of works/specification & ensure all documents are current"
"label","6ec6ee72-4254-4f07-9db9-0f40cbec0b62","","label","Set out to be off current penetration drawing & Architectural",,,
"checkpoint-status",,"","checkpoint","Approved Material delivered to site & stored/ secured safely"
"checkpoint-status",,"","checkpoint","Latest DWG file sent to surveyor. With correct floor levels understood & attained"
"checkpoint-status",,"","checkpoint","Work area accessible & acceptable"
"label","fe09433b-a23d-48c4-a4cb-092adf608bdd","","label","FINAL - Pass when happy to proceed with work(s) (Any issues please comment below)",,,
"checkpoint-status",,"","checkpoint","Concrete Pour Details (Pass once details inputted)"
"text","abe217fd-dd67-4a3a-81fb-77a2b72aff1c","","text","Date",,,
"text","37c8e8e8-4ce0-47ee-aebc-4c7ee5e300be","","text","Area/Zones to be Poured",,,
"text","067c9374-6979-4597-8864-266a99a2d3f0","","text","Installed by",,,
"text","a6ae5dad-a4d8-4891-832a-647ef6683f14","","text","Pour watched by",,,
"text","b121b14a-d802-4273-b06d-eaeb7ba889e8","","text","Pour marked out by",,,
"checkpoint-group",,"","section","Pressure Services"
"checkpoint-status",,"","checkpoint","Wall Penetrations for pressure & drainage services complete & Installed at correct Invert levels"
"checkpoint-status",,"","checkpoint","Downpipes with columns installed & capped off with DWV caps ONLY"
"checkpoint-status",,"","checkpoint","Sewer penetration points installed"
"label","7ed8411e-051a-4936-948c-8ab22646fa57","","label","Check off Hydraulic plans",,,
"checkpoint-status",,"","checkpoint","Stormwater penetration points installed"
"label","1e36117e-4bbe-4d8b-a3be-8b873f1ba108","","label","Check off Hydraulic plans",,,
"checkpoint-status",,"","checkpoint","Pressure services penetrations points installed"
"label","c9f8ccd5-a3d0-4290-ad14-cd7246279d89","","label","Check off Hydraulic plans",,,
"checkpoint-status",,"","checkpoint","Cast in services installed at correct grades (as per AS3500) & locations"
"label","508cb067-e23a-4b2d-b4ad-0d32b5cd6fb1","","label","Check off Hydraulic plans",,,
"checkpoint-status",,"","checkpoint","4 way riser drilled out where necessary"
"checkpoint-group",,"","section","Layouts"
"checkpoint-status",,"","checkpoint","Kitchen Layouts Checked"
"checkpoint-status",,"","checkpoint","Bathroom Layouts Checked"
"checkpoint-status",,"","checkpoint","Balcony Layouts & Cast Ins Checked"
"checkpoint-status",,"","checkpoint","Puddle flanges installed for floor wastes at minimum concrete height stated on structural drawings"
"checkpoint-group",,"","section","Penetrations"
"checkpoint-status",,"","checkpoint","ALL PENOS INSTALLED IN THE CENTRE OF MARKS"
"checkpoint-status",,"","checkpoint","Correct fire collars installed with Firedoc process undertaken for registering"
"checkpoint-status",,"","checkpoint","Miscellaneous penetrations installed"
"checkpoint-group",,"","section","Miscellaneous"
"checkpoint-status",,"","checkpoint","Car Park Drains Checked"
"checkpoint-status",,"","checkpoint","Car Park Risers Checked"
"checkpoint-status",,"","checkpoint","Trafficable grates to be class D Only"
"checkpoint-status",,"","checkpoint","Trench Drains installed"
"checkpoint-group",,"","section","Final Checks"
"checkpoint-status",,"","checkpoint","All pipe risers to be protected with pipe caps & or duck tape"
"checkpoint-status",,"","checkpoint","Update Asbuilt drawing immediately. Confirm IL of pipework, Surveyed Asbuilt to be provided also"
"checkpoint-status",,"","checkpoint","Top up water on the morning prior concrete pour for major castins"
"checkpoint-status",,"","checkpoint","Clean up & excess material stored away"
"checkpoint-status",,"","checkpoint","Pictures of works completed"
"checkpoint-status",,"","checkpoint","All works completed, reviewed & approved"
"label","596aee7d-1e77-46aa-bed2-c5df3814bf40","","label","FINAL - Pass when happy to proceed with work(s) (Any issues please comment below)",,,

"checklist-sectioned",,"","checklist","",,,,10,"No",,"4480963566cd28e8d6ea98956983a198ef0ef72268107757065c07a3f69c9467"
"checkpoint-group",,"","section","Prestart"
"checkpoint-status",,"","checkpoint","Latest consented drawings checked & referenced"
"text","3e35e01a-c8f5-48be-ad45-1c3fa10c1f88","","text","Drawing & revision number(s)",,,
"checkpoint-status",,"","checkpoint","Work area accessible & acceptable"
"label","79337c35-5fab-42bf-96cc-e118d73cf2d2","","label","FINAL - Pass when happy to proceed with work(s) (Any issues please comment below)",,,
"checkpoint-group",,"","section","Copper Risers QA"
"checkpoint-status",,"","checkpoint","Pressure schematic & floor plan printed & up to date"
"button","11f716f3-da70-464a-b7d4-eba48a886cf9","","button","Plan handed to tradesman","Yes, No, N/A",,
"checkpoint-status",,"","checkpoint","Copper risers & manifolds installed as per drawings"
"checkpoint-status",,"","checkpoint","Water turned on & tested at 1500KPA - for 4 hours"
"checkpoint-status",,"","checkpoint","Gas tested at 300KPA - for 4 hours"
"checkpoint-status",,"","checkpoint","Manifolds connected to apartments & water turned on, gas connected & air tuned on"
"checkpoint-status",,"","checkpoint","Pipework completed (As per below)"
"button","7faf98e9-5c87-405d-8f76-64c60c8cb5e1","","button","Hot water pipes thermal lagged","Yes, No",,
"button","089a68ae-85e9-44cc-8538-9b671a7bff33","","button","Pipes & manifolds clipped correctly","Yes, No",,
"button","37575eb5-5db6-44ca-ae21-864fdf7c8f48","","button","Pex pipes fire rated or smoke sealed correctly","Yes, No",,
"checkpoint-status",,"","checkpoint","Copper risers fire rated, labelled & Photographed (Attach below)"
"checkpoint-status",,"","checkpoint","Floor waste grate installed"
"checkpoint-status",,"","checkpoint","Cold water meter, Hot water meter & Gas meter/valve installed"
"button","1fcd6f38-b0e9-4b45-aecb-b4ba8d0756d5","","button","Outlet valves on all meters - except for as installed","Yes, No",,
