type,name,values,prefix,postfix,usage count,user addable,template name
checklist-flat,Trusses,,,,,,Trusses
checkpoint,"Truss locations checked, correct and approved as per latest revised drawing",,,,,,
checkpoint,Hardware fixings checked and correct,,,,,,
checkpoint,"All openings (doors / windows etc) checked, correct and approved",,,,,,
checkpoint,Truss checked (straight and plumb) and within tolerance,,,,,,
checkpoint,"All relevant nogs (service and special/fixtures) installed, checked and correct",,,,,,
bool,Service nogs checked and approved,,,,,,
bool,All other nogs checked and approved,,,,,,
checkpoint,All truss installation checks completed & inspections carried out,,,,,,
