resource,type,Add Step,Add Post,Tier 1,Tier 2 ,Tier 3,Tier 4,Tier 5,Tier 6,Tier 7,Tier 8,Tier 9
Precast Components ITP,checklist,,,INSPECTION TEST PLAN / CHECK LIST,,,,,,,,
,step,,,Checkers Checklist,,,,,,,,
Checkers Checklist (Tank Base),checklist,,,,Tank Base,,,,,,,
Checkers Checklist (Tank Wall),checklist,,,,Tank Wall,,,,,,,
Checkers Checklist (Internal Slab),checklist,,,,Internal Slab,,,,,,,
Checkers Checklist (Tank Lid),checklist,,,,Tank Lid,,,,,,,
,step,,,Installers Checklist,,,,,,,,
Installers Checklist (Tank Base),checklist,,,,Tank Base,,,,,,,
Installers Checklist (Tank Wall),checklist,,,,Tank Wall,,,,,,,
Installers Checklist (Internal Slab),checklist,,,,Internal Slab,,,,,,,
Installers Checklist (Tank Lid),checklist,,,,Tank Lid,,,,,,,
