type,name,values,prefix,postfix,usage count,user addable,template name
checklist-flat,Q05 Distribution Boards Checklist,,,,,,Q05 Distribution Boards Checklist
checkpoint,"Drawings are marked for construction, are the latest revision and are entered on drawing register",,,,,,
checkpoint,Available space has been checked and proposed distribution boards will fit,,,,,,
checkpoint,"Shop drawings have been submitted and approved
Available space has been re-checked and boards will fit",,,,,,
checkpoint,"Switchboard has been manufactured, factory inspection tests have been completed and switchboard is approved for delivery to site",,,,,,
checkpoint,"Switchboard has been installed
All connections have been checked, all penetrations have been sealed, all outgoing circuits are safe for energizing",,,,,,
checkpoint,"Distribution board and outgoing circuits have been tested
Testing records have been completed
Certificate of electrical safety has been submitted",,,,,,
checkpoint,Distribution Board and final sub-circuits have been energised,,,,,,
checkpoint,Final as Installed drawings have been drafted and submitted for approval,,,,,,
