"Rich Type","Id","Warnings","type","name","values","prefix","postfix","Usage Count","User Addable","Template Name","Template Id"
"checkpoint-status",,"","checkpoint","Pressure reductions installed on manifold x2 for each stage with M/V’s and Annubar for each stage"
"checkpoint-status",,"","checkpoint","Exhaust connected to pump and installed to approved discharge location"
"checkpoint-status",,"","checkpoint","Full tanks have been filled with Diesel; Electric Pumps AND Controls ready for energisation"
"checkpoint-group",,"","section","Completion"
"checkpoint-status",,"","checkpoint","Sign Off below - pass once complete"
"holdpoint",,"","signoff","Sign-Off - click to Add signature(s)"

"checklist-flat",,"","checklist","Document Attachment ITP (V.220421)","",,,5,"Yes","Document Attachment ITP (V.220421)","e69b2999-c406-4161-975e-cb1bd7ea3174"
"checkpoint-status",,"","checkpoint","Documents/Drawings attached for reference - Pass once attached"

"checklist-sectioned",,"","checklist","LM-FOR-40-ITR-302.2 Hydrant Installation","",,,5,"Yes","LM-FOR-40-ITR-302.2 Hydrant Installation","e82b240b-54f2-4a01-8b73-2dcbfb4644be"
"checkpoint-group",,"","section","Installation"
"checkpoint-status",,"","checkpoint","Hydrant supply pipe works completely installed of correct size, position, elevation, alignment and adequately supported in accordance with approved drawing/plan"
"text","dab84813-a3c5-52ec-8105-8d1f12a93eb4","","textbox","Hydrant No.",,,
"checkpoint-status",,"","checkpoint","Hydrostatic pressure testing of installed supply pipe works completed and accepted"
"checkpoint-status",,"","checkpoint","Hydrant valves and associated pipes and fittings used are in accordance with the approved specifications and applicable codes/standards"
"checkpoint-status",,"","checkpoint","Fire Hydrant and associated fire water main isolation valves locations are in accordance with the approved drawing/plan"
"checkpoint-status",,"","checkpoint","Hydrants stand pipe is adequately supported and bolted down. Concrete surround block provided for external hydrant"
"checkpoint-status",,"","checkpoint","Hydrant valve is between 750 to 1200 mm from finish floor/grade level"
"checkpoint-status",,"","checkpoint","Valve outlet is facing away from the wall and not more than 35O below its horizontal axis. Minimum 300 mm clearance around the valve outlet"
"checkpoint-status",,"","checkpoint","Minimum 1000 mm clear space in front of valve outlet is provided"
"checkpoint-status",,"","checkpoint","Valve handwheel clearance is minimum 100 mm clear of any obstruction at fully open"
"checkpoint-group",,"","section","Completion"
"checkpoint-status",,"","checkpoint","Sign Off below - pass once complete"
"holdpoint",,"","signoff","Sign-Off - click to Add signature(s)"

"checklist-flat",,"","checklist","Pre-start checklist (V.090322)","",,,1,"Yes","Pre-start checklist (V.090322)","ec31b851-c7a0-458b-9b42-4ed777aa9e5e"
"checkpoint-status",,"","checkpoint","Latest consented drawings checked & referenced"
"text","aa0103bb-34f4-516f-a903-7dcf41ff1936","","textbox","Drawing & Revision #",,,
"checkpoint-status",,"","checkpoint","Area clear, tidy and accessible"
"label","198f9f9d-94a9-5f32-a9da-dce066dbd57e","","note","Attach Photos/Comments below if any issues & send report to Builder",,,

"checklist-sectioned",,"","checklist","LM-FOR-50-ITR- 303.5 Fire Detection Fit Off (V160421)","",,,5,"Yes","LM-FOR-50-ITR- 303.5 Fire Detection Fit Off (V160421)","ef13a269-c386-49f8-a794-5c0758b8f00a"
"checkpoint-group",,"","section","Fit-Off"
"checkpoint-status",,"","checkpoint","Have all devices been installed in the correct position with no obstructions"
"checkpoint-status",,"","checkpoint","Have all detectors been installed in the correct position and addressed"
"checkpoint-status",,"","checkpoint","Have all input/output modules been installed in the correct position and addressed, with all enclosures sealed"
"checkpoint-status",,"","checkpoint","Have all magnetic door holders been installed correctly"
"checkpoint-status",,"","checkpoint","Have all input/output devices been installed and addressed for security fire trips"
"checkpoint-status",,"","checkpoint","Have all input/output devices been installed and addressed for mechanical fire trips"
"checkpoint-status",,"","checkpoint","Have all input/output devices been installed and addressed for AS 1668 Fan Controls"
"checkpoint-status",,"","checkpoint","Have the ELV and LV segregation rules been applied as per AS/CAS 009 (including 90 degrees crossovers) – Double check to make sure no other trades have been in after fire works"
"checkpoint-status",,"","checkpoint","Have all cables and conduits been installed in the correct position for devices"
"checkpoint-status",,"","checkpoint","Have all devices been terminated for testing purposes"
"checkpoint-group",,"","section","Cable Feeds"
"checkpoint-status",,"","checkpoint","Have all cable feeds been connected to the first device"
"checkpoint-status",,"","checkpoint","Have all cable feeds been connected to the last device"
"checkpoint-status",,"","checkpoint","Have cable feeds been connected at the panel"
"checkpoint-group",,"","section","Visual Check"
"checkpoint-status",,"","checkpoint","Check that no other services are run with or attached to fire detection cables"
"checkpoint-status",,"","checkpoint","Check that no cables have been damaged"
"checkpoint-status",,"","checkpoint","Check that all final cable locations are correct and match up with the “For Construction Drawings” and “Reflected Ceiling Plans”"
"checkpoint-status",,"","checkpoint","Check that all address tags and labels are clear and readable"
"checkpoint-status",,"","checkpoint","Have devices and address been noted on “As Constructed Drawings” for handover"
"checkpoint-status",,"","checkpoint","Have all stickers been installed to fire rated walls and smoke walls for penetrations"
"checkpoint-status",,"","checkpoint","Has photographic evidence been taken and recorded for all penetrations?"
"checkpoint-group",,"","section","Completion"
"checkpoint-status",,"","checkpoint","Sign Off below - pass once complete"
"holdpoint",,"","signoff","Sign-Off - click to Add signature(s)"

"checklist-sectioned",,"","checklist","LM-FOR-40-ITR-302.4 Tank Installation","",,,0,"Yes","LM-FOR-40-ITR-302.4 Tank Installation","f85d7c88-5e25-4b3a-b986-8bd9a3c3668e"
"checkpoint-group",,"","section","Installation"
"checkpoint-status",,"","checkpoint","Tank installation/construction is completed including associated pipe works in accordance with the approved drawing/plan"
"checkpoint-status",,"","checkpoint","Tank is free from dents, buckling, cracks, and internal is clean and free of any debris and construction materials"
"checkpoint-status",,"","checkpoint","Tank internal liner (if provided) is complete and properly bonded to tank wall/shell"
"checkpoint-status",,"","checkpoint","Tank quick infill line including associated infill valve and isolation valve installed and adequately supported"
"checkpoint-status",,"","checkpoint","Tank suction isolation valve is fitted in the correct position and operational in accordance with the approved drawing/plan"
"checkpoint-status",,"","checkpoint","Tank suction vortex inhibitor is fitted in the correct position and elevation in accordance with the approved drawing/plan"
"checkpoint-status",,"","checkpoint","Tank overflow is fitted in the correct position, elevation and properly piped to drain Adequate drain available"
"checkpoint-status",,"","checkpoint","Tank drain/sludge isolation valve is fitted and blank off"
"checkpoint-status",,"","checkpoint","Tank external water level indicator is fitted and operational"
"checkpoint-status",,"","checkpoint","Tank internal and external access ladders are fitted & secured"
"checkpoint-status",,"","checkpoint","Tank access hatch is fitted and provided with lockable cover"
"checkpoint-status",,"","checkpoint","Ball float for infill pilot line is fixed tightly, close to the manhole and away from the discharge path of tank infill"
"checkpoint-status",,"","checkpoint","Tank is located with minimum of 600 mm clearance around tank perimeter and roof line"
"checkpoint-group",,"","section","Completion"
"checkpoint-status",,"","checkpoint","Sign Off below - pass once complete"
"holdpoint",,"","signoff","Sign-Off - click to Add signature(s)"

