"Rich Type","Id","Warnings","type","name","values","prefix","postfix","Usage Count","User Addable","Template Name","Template Id"
"checklist-sectioned",,"","checklist","LM-FOR-50-ITR-303.3 Ewis Installation Fit Off","",,,5,"Yes","LM-FOR-50-ITR-303.3 Ewis Installation Fit Off","115fe391-8065-4bc0-8df1-50bc0fae3738"
"checkpoint-group",,"","section","EWIS Fit-Off"
"checkpoint-status",,"","checkpoint","Have all devices been installed in the correct position with no obstructions"
"checkpoint-status",,"","checkpoint","Have all speakers / horns been installed in the correct location"
"checkpoint-status",,"","checkpoint","Have all warden intercom points been installed in the correct location"
"checkpoint-status",,"","checkpoint","Have all emergency call points been installed in the correct location"
"checkpoint-status",,"","checkpoint","Have all strobes been installed in the correct location"
"checkpoint-status",,"","checkpoint","Have all background music points been installed in the correct location"
"checkpoint-status",,"","checkpoint","Have all microphone points been installed in the correct location"
"checkpoint-status",,"","checkpoint","Have the ELV and LV segregation rules been applied as per AS/CAS 009 (including 90 degrees crossovers) – Double check to make sure no other trades have been in after warning system works"
"checkpoint-status",,"","checkpoint","Have all cables and conduits been installed in the correct position for devices"
"checkpoint-status",,"","checkpoint","Have all devices been terminated for testing purposes"
"checkpoint-group",,"","section","Cable Feeds"
"checkpoint-status",,"","checkpoint","Have all cable supports been connected to the first device"
"checkpoint-status",,"","checkpoint","Have all end of lines been fitted and measured"
"checkpoint-status",,"","checkpoint","Have cables feeds been connected at the panel"
"checkpoint-group",,"","section","Visual Check"
"checkpoint-status",,"","checkpoint","Check that no other services are run with or attached to occupant/emergency warning cables or devices"
"checkpoint-status",,"","checkpoint","Check that no cables or devices have been damaged"
"checkpoint-status",,"","checkpoint","Check that all final device locations are correct and match up with the “For Construction Drawings” and “Reflected Ceiling Plans”"
"checkpoint-status",,"","checkpoint","Have devices and readings been noted on “As Constructed Drawings” for handover"
"checkpoint-status",,"","checkpoint","Have all stickers been installed to fire rated walls and smoke walls for penetrations"
"checkpoint-status",,"","checkpoint","Has photographic evidence been taken and recorded for all penetrations"
"checkpoint-group",,"","section","Completion"
"checkpoint-status",,"","checkpoint","Sign Off below - pass once complete"
"holdpoint",,"","signoff","Sign-Off - click to Add signature(s)"

"checklist-sectioned",,"","checklist","LM-FOR-50-ITR-303.2 Ewis Installation","",,,5,"Yes","LM-FOR-50-ITR-303.2 Ewis Installation","1649e9d2-7c70-4539-ae95-e49360961ddf"
"checkpoint-group",,"","section","Cabling"
"checkpoint-status",,"","checkpoint","Have all cable supports been installed in the correct position with no obstructions"
"checkpoint-status",,"","checkpoint","Have all cables been cable tied to soffit / catenary wire with no sagging or obstructions"
"checkpoint-status",,"","checkpoint","Have all cables been installed for speakers and horns"
"checkpoint-status",,"","checkpoint","Have all cables been installed for warden intercom points"
"checkpoint-status",,"","checkpoint","Have all cables been installed for emergency call points"
"checkpoint-status",,"","checkpoint","Have all cables been installed for strobes"
"checkpoint-status",,"","checkpoint","Have all cables been installed for background music inputs"
"checkpoint-status",,"","checkpoint","Have all cables been installed for microphone inputs"
"checkpoint-status",,"","checkpoint","Have the ELV and LV segregation rules been applied as per AS/CAS 009 (including 90 degrees crossovers)"
"checkpoint-status",,"","checkpoint","Have all cables been installed in the correct position for devices"
"checkpoint-status",,"","checkpoint","Have all cables been joined through for testing purposes or fitted with end of line devices"
"checkpoint-group",,"","section","Cable Feeds"
"checkpoint-status",,"","checkpoint","Have all cable supports been installed in the correct position with no obstructions"
"checkpoint-status",,"","checkpoint","Have all cable feeds been installed in the correct position"
"checkpoint-status",,"","checkpoint","Have all cables been tied to cable tray with steel ties with no sagging or obstructions"
"checkpoint-status",,"","checkpoint","Have all cable trays been installed correctly and secured including joiners and bends"
"checkpoint-status",,"","checkpoint","Have the modified cable trays been re-galvanized"
"checkpoint-group",,"","section","Visual Check"
"checkpoint-status",,"","checkpoint","Check that no other services are run with or attached to occupant/emergency warning cables"
"checkpoint-status",,"","checkpoint","Check that no cables have been damaged"
"checkpoint-status",,"","checkpoint","Check that all final cable locations are correct and match up with the “For Construction Drawings” and “Reflected Ceiling Plans”"
"checkpoint-status",,"","checkpoint","Have all cable runs, cable trays and penetrations been mark on “As Constructed Drawings” for handover"
"checkpoint-status",,"","checkpoint","Have all stickers been installed to fire rated walls and smoke walls for penetrations"
"checkpoint-status",,"","checkpoint","Has photographic evidence been taken and recorded for all penetrations"
"checkpoint-group",,"","section","Completion"
"checkpoint-status",,"","checkpoint","Sign Off below - pass once complete"
"holdpoint",,"","signoff","Sign-Off - click to Add signature(s)"

"checklist-sectioned",,"","checklist","LM-FOR-33-ITR-401 Sprinkler & Hydrant hydrostatic test","",,,5,"Yes","LM-FOR-33-ITR-401 Sprinkler & Hydrant hydrostatic test","1977f70e-428b-4f2f-9fb2-4c125c461856"
"checkpoint-group",,"","section","Guidelines"
"checkpoint-status",,"","checkpoint","Guidelines understood - Pass once read"
"label","96bd7276-beef-523e-98b9-9da245a63cb3","","note","Guidelines: Fire Sprinkler Systems – 1600 kPa or 400 kPa above the maximum static pressure for a duration of 2 hours (Check notes on Construction Drawing for nominated test pressure)",,,
"label","a98cfa63-41fa-5983-8382-39c2359f5260","","note","Fire Hydrant Systems (Low Rise) – 1700 kPa or 1.5 times the design pressure for a duration of 2 hours (Check notes on Construction Drawing for nominated test pressure)",,,
"label","8d48a861-b638-5b8e-8f82-f87018fd8cf9","","note","Playhouse Theatre – 1200 kPa or 1.5 times the design pressure for a duration of 2 hours. (Check notes on Construction Drawing for nominated test pressure)",,,
"checkpoint-group",,"","section","Rough In Only OR Rough In & Fit Off Together"
"checkpoint-status",,"","checkpoint","First Sighting - Pass once entered - attach photo of pressure gauge and builder sign off if required"
"checkpoint-status",,"","checkpoint","Second Sighting - Pass once entered - attach photo of pressure gauge and builder sign off if required"
"checkpoint-group",,"","section","Fit Off (if required ie if not covered by the above section)"
"checkpoint-status",,"","checkpoint","Subsequent Sighting - Pass once entered - attach photo of pressure gauge and builder sign off if required"

"checklist-sectioned",,"","checklist","LM-FOR-40-ITR-302.5 Booster Assembly","",,,0,"Yes","LM-FOR-40-ITR-302.5 Booster Assembly","20b34693-9112-40d5-86a8-d8b614c93b12"
"checkpoint-group",,"","section","Installation"
"checkpoint-status",,"","checkpoint","All pipework are installed in the correct position and alignment in accordance with the approved drawing/plan"
"checkpoint-status",,"","checkpoint","All pipework have been pressure tested and accepted in accordance to approved pressure testing procedure"
"checkpoint-status",,"","checkpoint","Fire Brigade Booster is located within sight of the main entrance to the building"
"checkpoint-status",,"","checkpoint","Concrete plinth provided for the booster location and hard stand for fire brigade pumping appliance"
"checkpoint-status",,"","checkpoint","Feed Hydrant is located within 8 metres from fire brigade appliance hard stand"
"checkpoint-status",,"","checkpoint","Fire water storage tank suction point (Storz) is located within 4 metres from fire brigade appliance hard stand"
"checkpoint-status",,"","checkpoint","Fire water storage tank suction point (Storz) is located within 10 metres from fire brigade booster inlet connection"
"checkpoint-status",,"","checkpoint","Centre distance between feed hydrant and booster inlet connection is 450 mm minimum and 5 m maximum"
"checkpoint-status",,"","checkpoint","The height of Feed Hydrant Outlet and Booster Inlet Connection is minimum 750 mm and maximum 1200 mm from FFL"
"checkpoint-status",,"","checkpoint","Valves face minimum 150-mm from door and valve handles are 100-mm from cabinet sides"
"checkpoint-status",,"","checkpoint","The number of feed hydrant outlet installed is equal to number of fire brigade booster assembly inlets"
"checkpoint-status",,"","checkpoint","The required number of fire brigade booster inlets installed is suitable for the system requirement or minimum of 2 inlets"
"checkpoint-status",,"","checkpoint","Full flow non-return valve of correct size is installed in the proper location"
"checkpoint-status",,"","checkpoint","Approved type of cabinet enclosure is installed as required"
"checkpoint-group",,"","section","Completion"
"checkpoint-status",,"","checkpoint","Sign Off below - pass once complete"
"holdpoint",,"","signoff","Sign-Off - click to Add signature(s)"

"checklist-sectioned",,"","checklist","LM-FOR-40-ITR-302.3 Hose Reel Installation","",,,5,"Yes","LM-FOR-40-ITR-302.3 Hose Reel Installation","34164c1b-03f6-4185-827b-ed5378ae9bce"
"checkpoint-group",,"","section","Installation"
"checkpoint-status",,"","checkpoint","Hose Reel supply pipe works completely installed of correct size, position, elevation, alignment and adequately supported in accordance with approved drawing/plans"
"text","511db77d-b2b5-5249-8f94-2df74e6d963b","","textbox","Hose Reel No.",,,
"checkpoint-status",,"","checkpoint","Hydrostatic pressure testing of installed pipe works completed and accepted"
"checkpoint-status",,"","checkpoint","Hose Reel and associated valves, pipes and fitting used are in accordance with the approved specifications and applicable codes/standards"
"checkpoint-status",,"","checkpoint","Hose Reel located along normal path of travel to nearest exit and readily accessible"
"checkpoint-status",,"","checkpoint","Verify and confirm hose length to be 36-metres or 40-meters"
"checkpoint-status",,"","checkpoint","Hose reel spindle is 1400 mm minimum to 2400 mm maximum above floor level. Stop valve is 1000 + 100 mm above floor level"
"checkpoint-status",,"","checkpoint","Minimum radial clearance of 100 mm between the reel rim and cabinet/cavity to the sides, above and below"
"checkpoint-status",,"","checkpoint","Minimum 100 mm clearance around the stop valve handwheel/handle"
"checkpoint-status",,"","checkpoint","Any defects found on the hose reel assembly have been corrected"
"checkpoint-group",,"","section","Completion"
"checkpoint-status",,"","checkpoint","Sign Off below - pass once complete"
"holdpoint",,"","signoff","Sign-Off - click to Add signature(s)"

"checklist-sectioned",,"","checklist","LM-FOR-50-ITR-303.1 Fire Panel Installation","",,,0,"Yes","LM-FOR-50-ITR-303.1 Fire Panel Installation","38a33e10-8d9a-4cd5-92c7-d1c19499c0d2"
"checkpoint-group",,"","section","Fire Indicator Panel"
"checkpoint-status",,"","checkpoint","Are visual indicators and controls not less than 750 mm from the floor"
"checkpoint-status",,"","checkpoint","Are visual indicators and controls not more than 1850 mm from the floor"
"checkpoint-status",,"","checkpoint","Connected to Brigade - Is the fire indicator panel clearly visible and readily accessible within the designated building entry point or the fire control room"
"checkpoint-status",,"","checkpoint","Not Connected to Brigade - Is the fire indicator panel in a secure location and clearly visible and readily accessible to authorized personnel"
"checkpoint-group",,"","section","Accessibility"
"checkpoint-status",,"","checkpoint","Is the fire indicator panel obscured by a door (if No, continue to CLEARANCE)"
"checkpoint-status",,"","checkpoint","Is the door marked in a contrasting colour to the general colour scheme with the words “FIRE PANEL” in letters not less than 50mm high"
"checkpoint-status",,"","checkpoint","Is the door absent of locks"
"checkpoint-status",,"","checkpoint","Where the door reduces the CIE sounder sound level below the CIE requirement, means are provided to give the required sound level outside the covering door"
"checkpoint-status",,"","checkpoint","A minimum clearance is maintained from the enclosure as shown"
"checkpoint-group",,"","section","Power sources"
"checkpoint-status",,"","checkpoint","Is the battery enclosure located such that the batteries are readily accessible for inspection"
"checkpoint-status",,"","checkpoint","Are the connecting leads to the battery clearly labelled to reduce the possibility of reverse connections to the battery"
"checkpoint-status",,"","checkpoint","The battery is not be tapped for intermediate voltages"
"checkpoint-status",,"","checkpoint","All connections are made using suitable connectors"
"checkpoint-group",,"","section","Sub-Indicator Panels"
"checkpoint-status",,"","checkpoint","The SIP shall only serve areas on one level of a building unless - Pass once below considered"
"button","e4010e88-c2e9-5fad-be1b-4f67cfa508c9","","button","(a) The SIP serves the entire building","Yes,No",,
"button","03258cea-bfcc-5e49-883d-44b59af25323","","button","(b) All zones connected to the SIP are readily accessible without leaving the area served by the SIP; or","Yes,No",,
"button","9e43733d-3b3c-5306-9f8c-feb5ebb2e6d0","","button","(c) The location of each zone in alarm at the SIP can be identified at the designated building entry point","Yes,No",,
"button","9843990c-3551-5ea8-9ccd-359768eb2cee","","button","Where the SIP serves the entire building, it shall be installed in accordance with the requirements for an FIP","Yes,No",,
"button","466b5f32-a6c8-5aa0-8ecc-1d497f99f5e4","","button","If the SIP serves a specific area, is it located at the main point of entry into that area","Yes,No",,
"checkpoint-group",,"","section","Wiring"
"checkpoint-status",,"","checkpoint","The extra low voltage wiring of the fire detection and alarm system is be kept separate and distinct from all other systems"
"checkpoint-status",,"","checkpoint","The extra low voltage wiring of the fire detection and alarm system is installed in accordance with the requirements of AS/ACIF S009"
"checkpoint-status",,"","checkpoint","Other wiring is installed in accordance with the electrical safety requirements of AS/NZS"
"checkpoint-status",,"","checkpoint","Externally energized circuits at voltages in excess of extra low voltage, except the power source for CIE, do not enter any CIE enclosure"
"checkpoint-group",,"","section","Completion"
"checkpoint-status",,"","checkpoint","Sign Off below - pass once complete"
"holdpoint",,"","signoff","Sign-Off - click to Add signature(s)"

"checklist-sectioned",,"","checklist","LM-FOR-30-ITR-301.2 Alarm Control Valve","",,,0,"Yes","LM-FOR-30-ITR-301.2 Alarm Control Valve","478fa878-2813-45b5-ba19-f83ed4057806"
"checkpoint-group",,"","section","Installation"
"checkpoint-status",,"","checkpoint","Supply and Installation pipe works are installed in the correct position and alignment in accordance with the approved drawing/plan"
"checkpoint-status",,"","checkpoint","All supports are completely installed, spaced and bolted down"
"checkpoint-status",,"","checkpoint","All roll grooved couplings / flanges are properly tightened"
"checkpoint-status",,"","checkpoint","Correct size and specification of Alarm Valve is installed in accordance with the approved drawing/plan"
"checkpoint-status",,"","checkpoint","Approved type of Monitored Main Stop Valve is fitted and operational"
"checkpoint-status",,"","checkpoint","Correct size of alarm line is installed, adequately supported and alarm gong is properly piped to drain"
"checkpoint-status",,"","checkpoint","Correct size of orifice is fitted and piped to drain when system is with retard chamber"
"checkpoint-status",,"","checkpoint","Main waste & test valve is fitted and piped to drain"
"checkpoint-status",,"","checkpoint","Correct type and model of Direct Brigade Alarm device is fitted"
"checkpoint-status",,"","checkpoint","Correct model and range of Pressure Switch is fitted"
"checkpoint-status",,"","checkpoint","Correct size and range of supply and installation pressure gauges with shut-off cocks are fitted"
"checkpoint-status",,"","checkpoint","All signalling devices (Monitored Stop Valve, DBA, Low Pressure Switch), are wired back to FIP"
"checkpoint-status",,"","checkpoint","Control Valve associated pipe works paint touch-up repair is completed"
"checkpoint-group",,"","section","Completion"
"checkpoint-status",,"","checkpoint","Sign Off below - pass once complete"
"holdpoint",,"","signoff","Sign-Off - click to Add signature(s)"

"checklist-flat",,"","checklist","Additional Tasks - add as required","",,,0,"Yes","Additional Tasks - add as required","65c274c6-82bf-42ee-a49c-a20b3adacd02"
"checkpoint-status",,"","checkpoint","Details of additional tasks - comment below"

"checklist-sectioned",,"","checklist","LM-FOR-30-ITR-301.1 Sprinkler Control Valve","",,,5,"Yes","LM-FOR-30-ITR-301.1 Sprinkler Control Valve","8e426a1f-26f9-4161-9046-e413466017b2"
"checkpoint-group",,"","section","Installation"
"checkpoint-status",,"","checkpoint","Supply and Installation pipe works are installed in the correct position and alignment in accordance with the approved drawing/plan"
"checkpoint-status",,"","checkpoint","All supports are completely installed, spaced and bolted down box / assembly secured"
"checkpoint-status",,"","checkpoint","All roll grooved couplings / flanges are properly tightened"
"checkpoint-status",,"","checkpoint","Valve station drain is properly connected to risers drain and building hydraulic drainage"
"checkpoint-status",,"","checkpoint","Approved type of Monitored Main Stop Valve is fitted and operational"
"checkpoint-status",,"","checkpoint","All specific signage is installed lock shut / lock open including FSV number of M/V’s"
"checkpoint-status",,"","checkpoint","Correct size and range of supply and installation pressure gauges with shut-off cocks are fitted"
"checkpoint-status",,"","checkpoint","Correct type solenoid, flow switch, couplings etc installed"
"checkpoint-status",,"","checkpoint","Correct size and range of supply and installation pressure gauges with shut-off cocks are fitted"
"checkpoint-status",,"","checkpoint","Confirm GFA on solenoid activation/ flow switch/ MV activation"
"checkpoint-status",,"","checkpoint","Control Valve is positioned between 1150mm to 1800mm"
"checkpoint-group",,"","section","Completion"
"checkpoint-status",,"","checkpoint","Sign Off below - pass once complete"
"holdpoint",,"","signoff","Sign-Off - click to Add signature(s)"

"checklist-sectioned",,"","checklist","LM-FOR-30-ITR-301 Sprinkler Installation/Fitoff","",,,5,"Yes","LM-FOR-30-ITR-301 Sprinkler Installation/Fitoff","95ec5577-17e2-499d-9424-0b0e29580f0c"
"checkpoint-group",,"","section","Sprinkler Rough-In"
"checkpoint-status",,"","checkpoint","Supports spacing & fixing as per AS2118"
"checkpoint-status",,"","checkpoint","Pipework installed as per drawings"
"checkpoint-status",,"","checkpoint","Concealed space sprinklers installed"
"checkpoint-status",,"","checkpoint","All ends blanked off/plugged for testing"
"checkpoint-status",,"","checkpoint","Pipes left out"
"label","ad9438ba-2212-5d6a-ad70-7419cd3f140c","","note","Fail=Missing, Pass=Complete",,,
"button","6cca11af-854e-546a-bfe9-da47a2c281e9","","button","Pipes left out - installed","Yes,No",,
"checkpoint-group",,"","section","Sprinkler Fit-Off"
"checkpoint-status",,"","checkpoint","Ceiling grid levelled"
"checkpoint-status",,"","checkpoint","Sprinklers installed as per drawings"
"checkpoint-status",,"","checkpoint","Sprinkler Type & temperature as per drawings"
"checkpoint-status",,"","checkpoint","All escutcheon plates installed"
"checkpoint-status",,"","checkpoint","Areas not fitted-off"
"label","cff97852-a9f5-577b-8db3-37d32c1e92a2","","note","Fail=Missing, Pass=Complete",,,
"button","c7c2d708-c7db-59c6-95a4-fceae40eb858","","button","Areas not fitted-off - completed","Yes,No",,
"checkpoint-status",,"","checkpoint","Client Sign Off Sheets Complete"
"checkpoint-status",,"","checkpoint","Painting carried out"
"checkpoint-status",,"","checkpoint","Pressure Tested (refer ITR 401) - Completed"
"checkpoint-group",,"","section","Completion"
"checkpoint-status",,"","checkpoint","Sign Off below - pass once complete"
"holdpoint",,"","signoff","Sign-Off - click to Add signature(s)"

"checklist-sectioned",,"","checklist","LM-FOR-50-ITR-303.4 Fire Detection Installation","",,,5,"Yes","LM-FOR-50-ITR-303.4 Fire Detection Installation","c89538b2-f461-445a-8dec-e6a0862aa9ec"
"checkpoint-group",,"","section","Cabling"
"checkpoint-status",,"","checkpoint","Have all cable supports been installed in the correct position with no obstructions"
"checkpoint-status",,"","checkpoint","Have all cables been cable tied to soffit / catenary wire with no sagging or obstructions"
"checkpoint-status",,"","checkpoint","Have all cables been installed for detectors"
"checkpoint-status",,"","checkpoint","Have all cables been installed for sprinkler valve sets"
"checkpoint-status",,"","checkpoint","Have all cables been installed for magnetic door holders"
"checkpoint-status",,"","checkpoint","Have all cables been installed for security fire trips"
"checkpoint-status",,"","checkpoint","Have all cables been installed for mechanical fire trips"
"checkpoint-status",,"","checkpoint","Have all cables been installed for AS 1668 Fan Controls"
"checkpoint-status",,"","checkpoint","Have the ELV and LV segregation rules been applied as per AS/CAS 009 (including 90 degrees crossovers)"
"checkpoint-status",,"","checkpoint","Have all cables been installed in the correct position for devices"
"checkpoint-status",,"","checkpoint","Have all cables been joined through for testing purposes"
"checkpoint-group",,"","section","Cable Feeds"
"checkpoint-status",,"","checkpoint","Have all cable supports been installed in the correct position with no obstructions"
"checkpoint-status",,"","checkpoint","Have all cable feeds been installed in the correct position"
"checkpoint-status",,"","checkpoint","Have all cables been tied to cable tray with steel ties with no sagging or obstructions"
"checkpoint-status",,"","checkpoint","Have all cable trays been installed correctly and secured including joiners and bends"
"checkpoint-status",,"","checkpoint","Have the modified cable trays been re-galvanized"
"checkpoint-group",,"","section","Visual Check"
"checkpoint-status",,"","checkpoint","Check that no other services are run with or attached to fire detection cables"
"checkpoint-status",,"","checkpoint","Check that no cables have been damaged"
"checkpoint-status",,"","checkpoint","Check that all final cable locations are correct and match up with the “For Construction Drawings” and “Reflected Ceiling Plans”"
"checkpoint-status",,"","checkpoint","Have all cable runs, cable trays and penetrations been mark on “As Constructed Drawings” for handover"
"checkpoint-status",,"","checkpoint","Have all stickers been installed to fire rated walls and smoke walls for penetrations"
"checkpoint-status",,"","checkpoint","Has photographic evidence been taken and recorded for all penetrations?"
"checkpoint-group",,"","section","Completion"
"checkpoint-status",,"","checkpoint","Sign Off below - pass once complete"
"holdpoint",,"","signoff","Sign-Off - click to Add signature(s)"

"checklist-sectioned",,"","checklist","LM-FOR-40-ITR-302.1 Fire Pump Installation","",,,0,"Yes","LM-FOR-40-ITR-302.1 Fire Pump Installation","cec32d64-0a54-45c9-b416-3ceda74933b0"
"checkpoint-group",,"","section","Installation"
"checkpoint-status",,"","checkpoint","Pump installation arrangement including suction and discharge pipe works are in accordance with the approved drawing/plan"
"checkpoint-status",,"","checkpoint","Pump clearance is 1000 mm on all four sides and 600 mm between pumps"
"checkpoint-status",,"","checkpoint","Concrete plinth/foundation height is minimum 150 mm from FFL and 150 mm wider on all four sides of pump base"
"checkpoint-status",,"","checkpoint","Pump base is sitting squarely and bolted down Vibration mounts are properly anchored on plinth or inertia plinth"
"checkpoint-status",,"","checkpoint","Pump suction and discharge pipework are completely installed and connected Supports are adequately provided"
"checkpoint-status",,"","checkpoint","Control panels installed and bolted down, MFB have clear access around pump controller 1000mm Arc"
"checkpoint-status",,"","checkpoint","Suction isolation valve installed is OS & Y type"
"checkpoint-status",,"","checkpoint","Non-return valve is installed and located upstream of the isolation valve in pump discharge line"
"checkpoint-status",,"","checkpoint","Pump circulation-relief valve for electric driven pump is installed and piped to drain or tank return line"
"checkpoint-status",,"","checkpoint","Heat exchanger cooling water harness for diesel driven pump is installed and piped to drain or tank return line"
"checkpoint-status",,"","checkpoint","Pressure gauge with gauge cock is installed min 2Ø downstream of discharge flange or reducer"
