"Rich Type","Id","Warnings","type","name","values","prefix","postfix","Usage Count","User Addable","Template Name","Template Id"
"checklist-flat",,"","checklist","Subbie Rough-in Progression Checklist","",,,0,"Yes","Subbie Rough-in Progression Checklist","109a3ff5-4162-48bc-9a24-aae4f937bffc"
"checkpoint-status",,"","checkpoint","All work in Zone completed"
"label","b88dc3f8-1edb-51cc-8245-ada8b77a862e","","note","Pass once all work complete",,,
"checkpoint-status",,"","checkpoint","Any Progress Photos/File's attached for reference (Attach below)"
"checkpoint-status",,"","checkpoint","Rough-In completed to specification/drawings & Area left clean/tidy"
"label","1ae44209-1c61-58ab-a916-d6cecd303e02","","note","FINAL - Pass when happy to proceed with work(s) (Any issues please comment below)",,,

"checklist-flat",,"","checklist","Filters Fit-Off Checklist","",,,0,"Yes","Filters Fit-Off Checklist","13fadb8a-a12d-4e63-8335-201af1d8cd94"
"checkpoint-status",,"","checkpoint","Plenums clean of dirt & debris"
"checkpoint-status",,"","checkpoint","Filters installed correctly as per schedule (Any Issues Comment below)"

"checklist-flat",,"","checklist","Equipment Checklist","",,,70,"Yes","Equipment Checklist","1b082861-caa5-4d38-bc47-6a411378262e"
"checkpoint-status",,"","checkpoint","Correct unit installed as per latest drawing & schedule"
"button","fe01e783-b3e7-5252-9dab-c9ae43eade63","","button","Correctly supported with anti vibration as required","Yes, No",,
"checkpoint-status",,"","checkpoint","Flexible connections installed as required"
"checkpoint-status",,"","checkpoint","Access available & access panels marked on drawing"
"label","e50b2b08-8393-5771-96a7-8cdade328957","","note","Marked up drawing attached below if applicable",,,
"button","45f910c1-d95a-57df-a4e0-20116b9bd27e","","button","Correctly labelled as per latest drawing","Yes, No",,
"checkpoint-status",,"","checkpoint","Seismic bracing to requirements"
"checkpoint-status",,"","checkpoint","Installation completed to drawings/specification & Area left clean/tidy (Any Issues comment below)"

"checklist-flat",,"","checklist","Gripple Inspection Upload Checklist","",,,0,"Yes","Gripple Inspection Upload Checklist","1bc5841e-4c36-4912-8736-b5c8ced2aab5"
"checkpoint-status",,"","checkpoint","Gripple Seismic inspection completed"
"label","4ad238dd-41b0-5b62-a3b9-314188a7589e","","note","Attach report as applicable below",,,
"button","042a4565-0cbd-55ff-8b72-0071c9d9dbed","","button","Gripple inspector signature added below as applicable","Yes, No, N/A",,
"holdpoint",,"","signoff","If required - Click to request Gripple sign-off"

"checklist-flat",,"","checklist","Subbie Testing Progression Checklist","",,,0,"Yes","Subbie Testing Progression Checklist","2f05e8eb-b43c-4e56-b1f9-77a06c0de3ac"
"checkpoint-status",,"","checkpoint","All work in Zone completed"
"label","26b01a8a-58d0-5b2a-b5e2-ce1e87f12e55","","note","Pass once all work complete",,,
"checkpoint-status",,"","checkpoint","Any Progress Photos/File's attached for reference (Attach below)"
"checkpoint-status",,"","checkpoint","Testing completed to specification/drawings & Area left clean/tidy"
"label","800c0e80-9449-581c-937b-b15304745ebf","","note","FINAL - Pass when happy to proceed with work(s) (Any issues please comment below)",,,

"checklist-flat",,"","checklist","Flex Checklist","",,,13,"Yes","Flex Checklist","3b35f532-fedb-4cab-abd9-34f3af72130a"
"checkpoint-status",,"","checkpoint","Supported with duct saddle only, not from other trades materials"
"button","7960c631-8670-5fcf-8942-4fd38b50628d","","button","Not sagging on ceiling","Yes, No",,
"button","3dd23186-f127-563a-b74e-e944998a8177","","button","Dampers fully open","Yes, No",,
"checkpoint-status",,"","checkpoint","Correct as per latest drawing"
"checkpoint-status",,"","checkpoint","Flex Installation completed to drawings/specification & Area left clean/tidy (Any Issues comment below)"

"checklist-flat",,"","checklist","Ductwork Checklist","",,,11,"Yes","Ductwork Checklist (2)","5891394c-2b48-46cc-8152-0f1c9f179762"
"checkpoint-status",,"","checkpoint","Ductwork delivered, protected & clean - i.e plastic wrapped"
"checkpoint-status",,"","checkpoint","Marked off on latest drawing"
"button","aad637bb-89e7-5dc5-8f1f-c13b78571037","","button","Installed as per latest drawing","Yes, No",,
"button","13453be0-f522-56bc-8b5e-d1cfc66c4963","","button","Correct height as per drawing","Yes, No",,
"button","27cee1a9-3d80-553c-891a-787ec0020e80","","button","Duct flanges firmly bolted & sealed where required","Yes, No",,
"button","e9885fe5-d5b8-596a-b0cc-30cea07e0642","","button","Cleats installed as required","Yes, No",,
"button","fc441e6b-dae1-574e-a9ab-bc7d6a98fe48","","button","Insulated as required/ damage free","Yes, No",,
"checkpoint-status",,"","checkpoint","Supported to requirements"
"button","4818b297-2c20-5160-b291-216885f8d42e","","button","Correct hanger spacing","Yes, No",,
"button","710acb70-ebd3-52b5-9380-cecd010377d8","","button","Correct rod length","Yes, No",,
"checkpoint-status",,"","checkpoint","Volume dampers installed as per drawing"
"checkpoint-status",,"","checkpoint","Smoke dampers installed as per drawing"
"button","009aa372-bd4c-5fb6-83d9-ab6d668b4037","","button","Dampers open & free moving","Yes, No",,
"checkpoint-status",,"","checkpoint","Damage free post-install & Area left clean/tidy (Any Issues comment below)"

"checklist-flat",,"","checklist","Drain Fit-Off Testing Checklist","",,,14,"Yes","Drain Fit-Off Testing Checklist","5b83d350-bb40-4d43-828d-aee2323a781c"
"checkpoint-status",,"","checkpoint","Drain has been terminated into tundish"
"checkpoint-status",,"","checkpoint","Drain has had final test, traps are full"

"checklist-flat",,"","checklist","Penetration Details","",,,0,"Yes","Penetration Details","6112d852-e437-45a3-b617-bb9b6d08de41"
"checkpoint-status",,"","checkpoint","Wall penetration sealing to requirements"

"checklist-flat",,"","checklist","Grilles Fit-Off Checklist","",,,12,"Yes","Grilles Fit-Off Checklist","6bf0b047-11fd-47d8-a37f-77d8531c5844"
"checkpoint-status",,"","checkpoint","Grilles, Registers, Diffusers fit off as per latest drawing/ schedule"
"button","e9d890ae-32ac-5e28-bce9-3c4652599059","","button","Free of any damage","Yes, No",,
"button","ad1fa97a-b35b-5f09-9df4-311159ea13fd","","button","Grilles installed flush to ceiling","Yes, No",,
"button","2ba165bb-2ce2-51a8-9de2-453f104dd565","","button","Boxes sealed to grill","Yes, No",,
"button","9dbec553-6ff4-51e2-ba88-020639421f58","","button","Grille finish/colour as per latest spec","Yes, No",,
"checkpoint-status",,"","checkpoint","Grilles Fit-Off completed to drawings/specification & Area left clean/tidy (Any Issues comment below)"

"checklist-flat",,"","checklist","Subbie Fit-off Progression Checklist","",,,0,"Yes","Subbie Fit-off Progression Checklist","6d2b9223-a376-470c-80cf-0b01c04ebdaf"
"checkpoint-status",,"","checkpoint","All work in Zone completed"
"label","2d5db6d3-7098-5516-80fc-6c0628ee48f5","","note","Pass once all work complete",,,
"checkpoint-status",,"","checkpoint","Any Progress Photos/File's attached for reference (Attach below)"
"checkpoint-status",,"","checkpoint","Fit-Off completed to specification/drawings & Area left clean/tidy"
"label","5fa83d87-7f25-592e-b896-d44974e394c2","","note","FINAL - Pass when happy to proceed with work(s) (Any issues please comment below)",,,

"checklist-flat",,"","checklist","As Builts Checklist","",,,0,"Yes","As Builts Checklist","6ff4a56a-4d63-41c0-8a34-86880dd4f241"
"checkpoint-status",,"","checkpoint","Update As-Built's of any know changes (Attach if applicable)"

"checklist-flat",,"","checklist","Penetration Details","",,,11,"Yes","SYS - Penetration Details (old version)","7173648c-ed0d-494e-9833-cc5671200070"
"checkpoint-status",,"","checkpoint","Studio wall penetration sealing to requirements"

"checklist-flat",,"","checklist","Cushion Boxes Checklist","",,,9,"Yes","Cushion Boxes Checklist","8b6576b3-e256-43a1-9d6f-647bdaacb88a"
"checkpoint-status",,"","checkpoint","Correct size as per latest schedule"
"checkpoint-status",,"","checkpoint","Secured & sealed"
"button","1a51a707-77e0-5139-9410-8341495a22c9","","button","Flexible duct connected neat & secure","Yes, No",,
"checkpoint-status",,"","checkpoint","Cushion box damper installed & open"
"checkpoint-status",,"","checkpoint","Diffuser cut out marked on ceiling (Attach Photos if applicable)"
"checkpoint-status",,"","checkpoint","Cushion Box Installation completed to drawings/specification & Area left clean/tidy (Any Issues comment below)"

"checklist-flat",,"","checklist","Pipework Checklist","",,,13,"Yes","Pipework Checklist","9ddba090-45b9-4336-b3ba-d10fb7009a23"
"checkpoint-status",,"","checkpoint","Installed as per latest drawing"
"checkpoint-status",,"","checkpoint","Correct heights i.e. underside as per drawings"
"checkpoint-status",,"","checkpoint","Pipe fittings complete"
"checkpoint-status",,"","checkpoint","Clips complete"
"checkpoint-status",,"","checkpoint","Insulation complete"
"checkpoint-status",,"","checkpoint","Air bleed complete (installed at all floor high points)"
"checkpoint-status",,"","checkpoint","Drain points complete"
"checkpoint-status",,"","checkpoint","Correct flow and return checked"
"checkpoint-status",,"","checkpoint","Access to valve sets checked'"
"checkpoint-status",,"","checkpoint","No other services suspended from pipe work"
"checkpoint-status",,"","checkpoint","Welds checked"
"checkpoint-status",,"","checkpoint","Damage free"
"checkpoint-status",,"","checkpoint","Piping cleaned and flushed"
"checkpoint-status",,"","checkpoint","Pipe tested and recorded as per Pipe Testing ITP"
"checkpoint-status",,"","checkpoint","Initial pipe pressure test (attach photo below)"
"checkpoint-status",,"","checkpoint","24hr pipe pressure test (attach photo below)"

"checklist-flat",,"","checklist","Ductwork Checklist","",,,4,"Yes","Ductwork Checklist","a34a3ae3-f05c-4484-a47b-1a2fb4276128"
"checkpoint-status",,"","checkpoint","Ductwork delivered, protected & clean - i.e plastic wrapped"
"checkpoint-status",,"","checkpoint","Marked off on latest drawing"
"button","5bded124-845b-5512-b32c-a4530e62e97f","","button","Installed as per latest drawing","Yes, No",,
"button","f28d6dba-d3a0-5f2e-812e-c10f3fcca61b","","button","Correct height as per drawing","Yes, No",,
"button","835e68c7-eb54-5163-9020-795913c0771c","","button","Duct flanges firmly bolted & sealed where required","Yes, No",,
"button","c09183eb-6198-5425-9ec8-14fdb1f045cb","","button","Cleats installed as required","Yes, No",,
"button","f651eec6-831a-5d3f-b98d-9d64cfb62ff0","","button","Insulated as required/ damage free","Yes, No",,
"checkpoint-status",,"","checkpoint","Supported to requirements"
"button","8e8be4f6-145c-5825-95a5-63e5db39f417","","button","Correct hanger spacing","Yes, No",,
"button","c1b42b1e-3261-5e3e-932d-1969ed48b549","","button","Correct rod length","Yes, No",,
"checkpoint-status",,"","checkpoint","Volume dampers installed as per drawing"
"checkpoint-status",,"","checkpoint","Motorised dampers installed as per drawing"
"button","92d0dd5f-b15a-5acc-ab33-ce0b4df65bf0","","button","Dampers open & free moving","Yes, No",,
"checkpoint-status",,"","checkpoint","Acoustic penetration sealing to requirements"
"checkpoint-status",,"","checkpoint","Acoustic duct mounts to requirements"
"checkpoint-status",,"","checkpoint","Seismic bracing to requirements"
"checkpoint-status",,"","checkpoint","Damage free post-install & Area left clean/tidy (Any Issues comment below)"

"checklist-flat",,"","checklist","Access Panel Markup Checklist","",,,0,"Yes","Access Panel Markup Checklist","b70c9894-4e73-4452-b9d8-1b52c466c16a"
"checkpoint-status",,"","checkpoint","Marked up completed & attached"
"button","bd339e67-eeba-5d7c-8596-379e43909138","","button","Submitted to draftsman","Yes, No",,

"checklist-sectioned",,"","checklist","Fit-Off Checklist (Full)","",,,0,"Yes","Fit-Off Checklist (Full)","c8e3abdf-3417-435a-8b1e-9177bc1487ef"
"checkpoint-group",,"","section","Drain Fit-Off Testing"
"checkpoint-status",,"","checkpoint","Drain has been terminated into tundish"
"checkpoint-status",,"","checkpoint","Drain has had final test, traps are full"
"checkpoint-group",,"","section","Grilles Fit-Off"
"checkpoint-status",,"","checkpoint","Grilles, Registers, Diffusers fit off as per latest drawing/ schedule"
"button","e418f326-fd77-56e7-9da3-d4acdb826751","","button","Free of any damage","Yes, No",,
"button","8f4db4af-49b4-508d-8aaa-3bcf9ee2b885","","button","Grilles installed flush to ceiling","Yes, No",,
"button","12830ca9-bdea-523f-9e7e-636f120d5645","","button","Boxes sealed to grill","Yes, No",,
"button","55727a2b-63e1-5a33-934e-0362620de567","","button","Grille finish/colour as per latest spec","Yes, No",,
"checkpoint-status",,"","checkpoint","Grilles Fit-Off completed to drawings/specification & Area left clean/tidy (Any Issues comment below)"
"checkpoint-group",,"","section","Filters Fit-Off"
"checkpoint-status",,"","checkpoint","Plenums clean of dirt & debris"
"checkpoint-status",,"","checkpoint","Filters installed correctly as per schedule (Any Issues Comment below)"

"checklist-flat",,"","checklist","Testing Checklist","",,,0,"Yes","Testing Checklist","d1788a8a-d9be-45fb-b042-7f78246917a6"
"checkpoint-status",,"","checkpoint","Test passed with air/water"
"checkpoint-status",,"","checkpoint","Test sighted by builder & signed off (Click to Add Signature below - If applicable)"
"button","da418233-4a22-5ef6-8841-71f0dfa29458","","button","Air bled from system","Yes, No",,

"checklist-flat",,"","checklist","Commissioning Checklist","",,,0,"Yes","Commissioning Checklist","debb5fbf-0a4f-4b2a-a9a5-e224f0e94cb2"
"checkpoint-status",,"","checkpoint","Commissioning completed (Pass once below completed)"
"button","14e154d5-7d81-59be-8c1f-44f06c73b53e","","button","Any issues during commissioning","Yes, No",,
"text","10f2878c-9b5a-54f2-a07d-363d5b1fb624","","textbox","If Yes, please specify",,,
"boolean","f5544c25-8b1b-5bea-9d72-38c9c0a442b2","","tickbox","Any commissioning reports/results attached (If applicable)",,,

"checklist-flat",,"","checklist","Drains Checklist","",,,15,"Yes","Drains Checklist","e094bfb4-3bd3-4227-bb0a-f2a692de34c3"
"checkpoint-status",,"","checkpoint","Drains installed with fall to tundish"
"button","f8bbff5b-441c-586c-b713-cdac5bbdefdb","","button","Pipes insulated as required","Yes, No",,
"button","65081be0-c166-5a3a-bd50-7f80d083d3e1","","button","Tundish installed","Yes, No",,
"checkpoint-status",,"","checkpoint","Drain has been tested (Test results attached if applicable)"
"checkpoint-status",,"","checkpoint","Drain(s) Installation completed to drawings/specification & Area left clean/tidy (Any Issues comment below)"
"checkpoint-status",,"","checkpoint","Drain has had final test, traps are full"

"checklist-flat",,"","checklist","Refrigeration Pipe Checklist","",,,4,"Yes","Refrigeration Pipe Checklist","f93b2e0c-dfd7-4cb7-ab63-2254fc57ac71"
"checkpoint-status",,"","checkpoint","Correct IDU & ODU installed as per latest drawing & schedule"
"checkpoint-status",,"","checkpoint","Installed as per latest drawings"
"checkpoint-status",,"","checkpoint","No other services suspended from pipe work (Attach Photos below)"
"checkpoint-status",,"","checkpoint","Installation damage free (Any Issues comment/attach Photos below)"
"button","c72dd8da-0ddd-5738-9771-82fdab1a3a62","","button","correct hanger spacing","Yes, No",,
"checkpoint-status",,"","checkpoint","Pipe labelled after insulation"
"boolean","35754fdf-e66f-5a8d-9793-929b36b4c844","","tickbox","Photo of Label attached",,,
"checkpoint-status",,"","checkpoint","Seismic bracing to requirements"
"checkpoint-status",,"","checkpoint","Pipe Mains Installation completed to drawings/specification & Area left clean/tidy (Any Issues comment below)"
"checkpoint-status",,"","checkpoint","Pipework system pressure tested"

