type,name,values,prefix,postfix,usage count,user addable,template name,
checklist-flat,Fit Off Checklist - Ladder Bracket,,,,,Yes,Fit Off Checklist - Ladder Bracket,cdac6382-b581-4ad4-b951-ae0f54a6992a
checkpoint,Confirm the structure is in accordance with the details supplied to PBI,,,,,,,
checkpoint,Photos taken of installed item,,,,,,,
checkpoint,Height from ground level to gutter,,,,,,,
label,Add comment,,,,,,,
checkpoint,Installed as per PBI drawings supplied and manufacturer's requirements,,,,,,,
