"Rich Type","Id","Warnings","type","name","values","prefix","postfix","Usage Count","User Addable","Template Name","Template Id"
"checklist-flat",,"","checklist","Installation Checklist","",,,0,"Yes","Installation Checklist","3dc88a61-8e45-41e4-89c8-d4ab0d700e80"
"checkpoint-status",,"","checkpoint","Bedding grout placed and finished as per project requirements"
"boolean","5659e634-0edc-56b2-99f3-a6d84558955f","","tickbox","Bedding grout (trowelable) used is as per project specification (PHOTO REQUIRED of the grout bag)",,,
"boolean","1f0f905d-83dd-5160-9005-7c7dc817de45","","tickbox","Grout mixed in line with manufacturers recommendations",,,
"boolean","3dc42e50-3a7d-56c0-aa7c-41b06d10dd1f","","tickbox","Grout bed sufficient to ensure full coverage (PHOTO REQUIRED of grout bed prior to landing element)",,,
"checkpoint-status",,"","checkpoint","Element installed to (PHOTO REQUIRED to show survey pins and spirit level bubble):"
"boolean","6e039ada-67c0-5564-94ad-970df8af7739","","tickbox","Survey Pins",,,
"boolean","eef66929-eba8-5df0-bff9-dceb2b513a1d","","tickbox","Within 5mm of vertical plumb",,,
"boolean","1432fb46-9160-55f3-8791-2e1415e300a5","","tickbox","Face alignment within 5mm",,,
"checkpoint-status",,"","checkpoint","Element propped as per Euro Precast PEDS (PHOTO REQUIRED of element propped)"
"boolean","3acdd6b2-b304-59b6-81a7-8eeaea23b2b7","","tickbox","Prop bolts installed with tool to ensure locking mechanism can't be removed by hand",,,
"checkpoint-status",,"","checkpoint","Dowel tube (flowable) grout placed and finished as per project requirements"
"boolean","d36ee8eb-f8b4-5fa9-8af9-6446f2c33a02","","tickbox","Dowel tube grout used is as per project specification (PHOTO REQUIRED of the grout bag)",,,
"boolean","5c226d10-2c0f-5b02-9e4b-7d1625cc39cc","","tickbox","Grout mixed in line with manufacturers recommendations",,,
"boolean","1fe3f8e2-d978-5a87-8800-268d3ace9332","","tickbox","Dowel tubes filled to top of tubes",,,
"checkpoint-status",,"","checkpoint","Is there any transport or erection damage that needs to be fixed (PHOTO REQUIRED of damaged area)"
"label","ee389f75-faf3-5542-922f-0885b6e6f3e6","","note","If there is damage, mark as FAIL. Once the damage is repaired, take another photo (PHOTO REQUIRED) and then change the status to PASS",,,
"checkpoint-status",,"","checkpoint","Area has been cleaned from grout and rubbish (PHOTO REQUIRED of the area before leaving)"

"checklist-flat",,"","checklist","Job Details","",,,1,"Yes","Job Details","841ba4cc-0c31-44ad-8f67-bccbe870fcb5"
"checkpoint-status",,"","checkpoint","Project details entered below"
"text","6f7ed719-f54b-5e1d-a15f-b26d7c90068a","","textbox","Job Number",,,
"text","d42e2a61-6c58-5ab2-b4c7-702040568762","","textbox","Project Name",,,
"text","d535d267-309f-58b4-93e7-0f993b2139c6","","textbox","Site Address",,,
"text","8d724ffb-eedd-550f-b035-150b925b91f8","","textbox","Builder",,,
"text","d87991e1-a2b1-5932-abfa-e362d149c62a","","textbox","Euro Precast Project Manager",,,
"text","de55437e-18d3-59fa-a866-3f90636981e6","","textbox","Euro Precast Lead Draftsperson",,,
"text","c054ca3c-a80a-54fa-a413-c82ed4a3edff","","textbox","Euro Precast Installer",,,
"checkpoint-status",,"","checkpoint","Grouts submitted for approval (UPLOAD TDS and SDS for each grout submitted)"
"checkpoint-status",,"","checkpoint","Have submitted grouts been approved? (UPLOAD copy of approval)"
"checkpoint-status",,"","checkpoint","Caulking products submitted for approval (UPLOAD TDS and SDS for each caulking product submitted)"
"checkpoint-status",,"","checkpoint","Have submitted caulking products been approved? (UPLOAD copy of approval)"
"checkpoint-status",,"","checkpoint","Patching products submitted for approval (UPLOAD TDS and SDS for each patching product submitted)"
"checkpoint-status",,"","checkpoint","Have patching products been approved? (UPLOAD copy of approval)"

"checklist-sectioned",,"","checklist","Manufacturing Checklist","",,,45,"Yes","Manufacturing Checklist","85d058ed-dea5-495a-bb59-3e159adc32b3"
"checkpoint-group",,"","section","Manufacturing Documents"
"checkpoint-status",,"","checkpoint","IFC Element Drawing"
"checkpoint-status",,"","checkpoint","Euro Precast Primary Lifting and Propping Certification"
"checkpoint-status",,"","checkpoint","Secondary Lifting Certification"
"checkpoint-group",,"","section","Pre-Pour Checks"
"checkpoint-status",,"","checkpoint","Mould check"
"boolean","1c40e063-5e51-571a-9aba-108d4990a3fb","","tickbox","Mould clean with release oil applied correctly",,,
"boolean","5d151dc5-8944-5f12-85d2-4df84dc475d7","","tickbox","Primary & diagonal dimensions checked",,,
"boolean","e220f895-916a-54bf-91df-8efdd9cd16e5","","tickbox","Openings Checked and Correct",,,
"boolean","acfc4602-3da2-5749-b1b3-66e48b8b55c6","","tickbox","Rebates, Architectural Grooves Installed Correctly",,,
"boolean","fc8e7065-3d1f-5e4e-9ddf-cf6846636304","","tickbox","Formwork chamfers installed correctly where required",,,
"checkpoint-status",,"","checkpoint","Reinforcing check"
"boolean","4f64cd37-0c58-5932-a670-9a20df352430","","tickbox","Correct Size and Type",,,
"boolean","e1a8bf70-df93-5972-a70b-1038ca19a2e5","","tickbox","Laps and Splices correct",,,
"boolean","d2bd4cd1-f5e5-53d2-b8bf-825dcda6a740","","tickbox","Cover Checked",,,
"boolean","cd84c8d1-457b-5221-b2de-70fcbc3bc7ef","","tickbox","Spacing Checked",,,
"checkpoint-status",,"","checkpoint","Cast in items check"
"boolean","17d421a5-44a2-5b59-89a7-93f2ef4f575f","","tickbox","Ferrules/Inserts installed, checked and correct",,,
"boolean","696087fa-5c2c-5df9-a436-d41932dd1173","","tickbox","Starter Bars inserted, checked and correct",,,
"boolean","29cab84f-2031-5ec1-a116-0299afca2b18","","tickbox","Lifting anchors installed, checked and correct",,,
"checkpoint-status",,"","checkpoint","Check Minimum Cover"
"checkpoint-status",,"","checkpoint","ID Tag installed in non-visible face"
"checkpoint-status",,"","checkpoint","Pre-Pour checks completed and approval given to pour Element"
"label","2abbd363-3313-5311-9d4c-7269d9a99e52","","note","Upload sufficient number of photos of element",,,
"checkpoint-status",,"","checkpoint","Upload photo of signed pre-pour check of shop drawing"
"checkpoint-group",,"","section","Concrete Pour Checks"
"checkpoint-status",,"","checkpoint","Concrete Strength correct as per design"
"boolean","db93ed56-0fad-5dd7-9d03-eb776661a5dc","","tickbox","All Concrete Dockets Attached",,,
"text","989257b9-9e07-5481-bf3b-21ee1f092588","","textbox","Date element was cast",,,
"checkpoint-group",,"","section","Post-Pour / Pre Delivery Checks"
"checkpoint-status",,"","checkpoint","Visual Check"
"boolean","1bfd951c-2c10-5e18-b477-51ba985c6624","","tickbox","Does the finish meet class 2 as per AS3610",,,
"boolean","1ff19a35-f210-5751-b3b4-5e5d73725cc9","","tickbox","Chamfers clean, neat and on all required edges",,,
"boolean","039b8a8b-d6c0-5cc9-8a29-4eefd0ff27e7","","tickbox","Lifting anchors checked and approved",,,
"boolean","d9bcaa4f-4b40-5c46-853b-52dda1843432","","tickbox","Critical fitments / fixtures checked and approved",,,
"boolean","abd113ce-e195-531d-9481-0a1bc088fd8d","","tickbox","Openings (formwork removed)",,,
"boolean","7b03872b-9816-55ca-adb5-5426a52926d9","","tickbox","Nailplates / Recesses etc removed",,,
"checkpoint-status",,"","checkpoint","Any Strongbacks Installed where required"
"checkpoint-status",,"","checkpoint","Element free from defects that will impact structural integrity or durability?"
"label","c8f3c8ff-4c61-5634-b59c-be56028273a0","","note","If 'FLAG', raise NCR and notify EP Project Manager to discuss with builder",,,
"boolean","4be4d717-d4a6-5d8c-ba22-2d40bd71b16b","","tickbox","If NCR raised, take photo of completed approved works",,,
"checkpoint-status",,"","checkpoint","All Post Pour Works complete - Element Checked, Approved and Ready for delivery"
"checkpoint-group",,"","section","Concrete Test Results"
"checkpoint-status",,"","checkpoint","Concrete Test Result attached"
"label","b1fbea8d-c7e9-5b1b-9ff1-a5e97a3dcb41","","note","Upload actual test result OR a test result of the same mix design from the same day",,,

"checklist-flat",,"","checklist","Safe Load Declaration Checklist","",,,0,"Yes","Safe Load Declaration Checklist","9b18916b-3fc8-4495-90c8-a3d3b1f453da"
"checkpoint-status",,"","checkpoint","Details complete"
"text","3f7eb459-930a-564b-912c-9ede888a7d67","","textbox","Date:",,,
"text","e3ec4814-c7b8-5523-85eb-d9feded10ff7","","textbox","Time truck arrived at Factory:",,,
"text","929db439-bc9f-5c4d-89cd-86c29d5ce81f","","textbox","Time truck departed Factory:",,,
"text","611c3083-8396-55c7-add1-7e80a36e0f35","","textbox","Transport Company:",,,
"text","f9c4f028-e6f0-595d-ba0b-73c79d2831af","","textbox","Truck Registration #",,,
"text","96103593-91e4-5c17-bfff-c951e73ca931","","textbox","Trailer Registration",,,
"select","aa2beac4-f2fc-5875-acf1-0bfe630f4c68","","dropdown","Trailer Type:","Drop Deck, Drop Deck No Frame, Flat Top, Layover, Super Layover, Commission",,
"checkpoint-status",,"","checkpoint","Upload photo of Load List used for load"
"checkpoint-status",,"","checkpoint","Upload photos of both sides of loaded truck (after being chained down)"
"checkpoint-status",,"","checkpoint","Load Declaration"
"label","9cc01920-c297-5bc1-85b6-205f7a7eecba","","note","In signing below, you agree and acknowledge that:",,,
"label","59709192-9b40-5d4e-a798-3a9779949285","","note","You are not permitted to leave the Euro Precast factory unless a Safe Load Declaration has been completed",,,
"label","570b85b3-70f7-52e7-afd9-aa05c45c915b","","note","You have been provided with a copy of the load list that indicates individual element weights and total approximate load weight (excluding trailer/frame weight)",,,
"label","767d2c5b-bc06-5bf2-b424-8b736e04a652","","note","You have chained down all units/elements in a safe and secure manner and in accordance with the latest published government/industry best practice guidance material",,,
"label","d4a2fafa-dd85-50f1-a82f-f33e1d9bf65b","","note","You will abide by all safety rules, PPE requirements and client instructions on the project site at all times.",,,
"label","05fdeed7-8860-5c0f-8238-0c4a46275295","","note","You as an individual, the truck, the trailer and load comply with the latest requirements of the Heavy Vehicle National Law and Regulations (HVNL)",,,
"holdpoint",,"","signoff","Driver Signature (must include Company)"

"checklist-flat",,"","checklist","Level Sign Off","",,,0,"Yes","Level Sign Off","cbc9b7f4-63d9-452f-a154-8f97a6128c3c"
"checkpoint-status",,"","checkpoint","Details complete"
"text","2ca15c98-a3ee-5b51-b778-c0d23e0f4cf6","","textbox","Date:",,,
"text","777e190c-0cca-5686-bde5-13aa3bee9772","","textbox","Level:",,,
"checkpoint-status",,"","checkpoint","Builder Sign Off"
"label","9b5ef753-87eb-5894-99fe-7a9c993df5e6","","note","In signing the below, you agree and acknowledge that on this level:",,,
"label","6a19231d-0850-5b72-a1aa-a654b5b6869a","","note","All props have been removed",,,
"label","63a7106e-41ad-555d-af26-c6613e3d96fe","","note","All grouting has been completed",,,
"label","83a0fe9e-88da-52ec-b602-a44496cf7c82","","note","All patching has been completed",,,
"label","9db588e0-86ce-50e5-8bd0-f89cd666f4ac","","note","All sealing has been completed",,,
"label","79023a19-1fcd-59b3-a2ab-42d9d8707734","","note","All issued defects have been completed",,,
"holdpoint",,"","signoff","BUILDER SIGNATURE (MUST INCLUDE NAME)"

"checklist-sectioned",,"","checklist","Variation works completed","",,,0,"Yes","Add New Variation","da3567ca-6a71-4701-80cf-44da3dd5c054"
"checkpoint-group",,"","section","Works completed"
"checkpoint-status",,"","checkpoint","Details entered below"
"text","c1876c5e-9363-593c-8eae-090e7e67aabe","","textbox","Date:",,,
"text","e48c2ef2-7c9a-5f60-8588-3bb024bff947","","textbox","Name of people who completed the works:",,,
"select","b90eac2f-d675-5854-8254-d73c31208848","","dropdown","Time started at site:","05:00AM, 05:30AM, 06:00AM, 06:30AM, 07:00AM, 07:30AM, 08:00AM, 08:30AM, 09:00AM, 09:30AM, 10:00AM, 10:30AM, 11:00AM, 11:30AM, 12:00PM, 12:30PM, 01:00PM, 01:30PM, 02:00PM, 02:30PM, 03:00PM, 03:30PM, 04:00PM, 04:30PM, 05:00PM, 05:30PM, 06:00PM, 06:30PM",,
"select","9c1bc354-2aa7-5474-b55a-79c1d825e492","","dropdown","Time finished at site:","05:00AM, 05:30AM, 06:00AM, 06:30AM, 07:00AM, 07:30AM, 08:00AM, 08:30AM, 09:00AM, 09:30AM, 10:00AM, 10:30AM, 11:00AM, 11:30AM, 12:00PM, 12:30PM, 01:00PM, 01:30PM, 02:00PM, 02:30PM, 03:00PM, 03:30PM, 04:00PM, 04:30PM, 05:00PM, 05:30PM, 06:00PM, 06:30PM",,
"text","4a6b40d7-361f-5737-b1e5-ea343ebf6761","","textbox","Consumables used:",,,
"text","89b4f543-41c5-5f1f-8493-03d9b87fa0e2","","textbox","Summary of works completed",,,
"checkpoint-group",,"","section","Builder sign-off"
"checkpoint-status",,"","checkpoint","Builder sign-off"
"label","26b61b0b-0ae9-5937-9b1f-38d7a598bfd9","","note","By signing below you acknowledge the above summary as a true and accurate record of the day.",,,
"holdpoint",,"","signoff","Builder Signature (must be authorised person)"

"checklist-sectioned",,"","checklist","Delivery / Installation Day Checklist","",,,1,"Yes","Delivery / Installation Day Checklist","ed233a0d-1134-471e-a8f2-5db17f4a6cf7"
"checkpoint-group",,"","section","HOLD POINT - Confirmation of slab strength"
"checkpoint-status",,"","checkpoint","Has the slab reached the minimum strength required (UPLOAD copy of concrete slab test result)"
"label","c9bbf854-3550-5dcf-b99e-2aa2642a158e","","note","12MPa for cast-in anchors and 20MPa for post installed anchors",,,
"checkpoint-group",,"","section","Prestart / Start-up"
"checkpoint-status",,"","checkpoint","Date of Installation"
"checkpoint-status",,"","checkpoint","Installation team completing the install today"
"label","2e9de6a9-8443-50b6-8719-3f96e702f0c9","","note","List names in comments",,,
"checkpoint-status",,"","checkpoint","Exclusion Zone is set up (PHOTO REQUIRED of the exclusion zone)"
"checkpoint-status",,"","checkpoint","Plant & Equipment prestart/logbooks filled out (PHOTO REQUIRED of logbooks)"
"checkpoint-status",,"","checkpoint","Toolbox Talk / Pre-Start has been completed (PHOTO REQUIRED of talk)"
"checkpoint-group",,"","section","Summary of the day"
"checkpoint-status",,"","checkpoint","Hours worked"
"select","78d03587-565c-5bab-926a-b4740dbf00a7","","dropdown","Time started on site","05:00AM, 05:30AM, 06:00AM, 06:30AM, 07:00AM, 07:30AM, 08:00AM, 08:30AM, 09:00AM, 09:30AM, 10:00AM, 10:30AM, 11:00AM, 11:30AM, 12:00PM, 12:30PM, 01:00PM, 01:30PM, 02:00PM, 02:30PM, 03:00PM, 03:30PM, 04:00PM, 04:30PM, 05:00PM, 05:30PM, 06:00PM, 06:30PM",,
"select","3c43c761-e0cc-5dda-a17e-e255c537b145","","dropdown","Time finished on site","05:00AM, 05:30AM, 06:00AM, 06:30AM, 07:00AM, 07:30AM, 08:00AM, 08:30AM, 09:00AM, 09:30AM, 10:00AM, 10:30AM, 11:00AM, 11:30AM, 12:00PM, 12:30PM, 01:00PM, 01:30PM, 02:00PM, 02:30PM, 03:00PM, 03:30PM, 04:00PM, 04:30PM, 05:00PM, 05:30PM, 06:00PM, 06:30PM",,
"checkpoint-status",,"","checkpoint","Elements Installed today"
"label","4d0b8069-eb4f-5b81-95fc-08e191d04ec9","","note","COMMENT below if number of elements installed doesn't match the Load Lists in the Safe Load Declarations",,,
"select","2ada973d-8803-5f88-8f23-e67ec388aa3e","","dropdown","How many elements were installed today?","1, 2, 3, 4, 5, 6, 7, 8, 9, 10, 11, 12, 13, 14, 15, 16, 17, 18, 19, 20, 21, 22, 23, 24, 25, 26, 27, 28, 29, 30, 31, 32, 33, 34, 35, 36, 37, 38, 39, 40",,
"checkpoint-status",,"","checkpoint","Were there any delays?"
"label","87faf9ba-5e3f-5b3d-aaee-0a556769d8b7","","note","COMMENT below in enough detail to explain the delay and what caused it. Add PHOTO if it helps record the delay.",,,
"select","d3140643-7f44-5203-8eb3-18b5642f0f44","","dropdown","How long was the delay?","N/A, 30mins, 1hr, 1.5hr, 2hr, 2.5hr, 3hr, 3.5hr, 4hr, 4.5hr, 5hr, 5.5hr, 6hr, 6.5hr, 7hr, 7.5hr, 8hr",,
"select","58046ee7-6a2f-55a4-9755-818c7abe3b68","","dropdown","How many installers were impacted by the delay/s?","1, 2, 3, 4, 5, 6",,
"select","ede201f0-4afc-511e-b34f-570146242cef","","dropdown","How many trucks were impacted by the delay/s?","1, 2, 3, 4, 5, 6",,
"checkpoint-status",,"","checkpoint","Builder sign-off"
"label","f4a9c5b1-6546-51e0-a12c-90fcd787c5e0","","note","By signing below you acknowledge the above summary as a true and accurate record of the day.",,,
"holdpoint",,"","signoff","Builder Signature (must be authorised person)"

"checklist-flat",,"","checklist","Grout Testing Checklist","",,,0,"Yes","Grout Testing Checklist","f68deb64-0d04-4ea8-bfd0-a40d1b78d035"
"checkpoint-status",,"","checkpoint","To organise grout testing, call Construction Sciences. Primary contact is Michael Hardcastle on 0429 791 069. Secondary contact is Joshua Borg on 0429 790 444"
"text","f3cc1cc7-9b94-5c2d-a958-d7372e91101b","","textbox","Date:",,,
"text","8e373d23-5c4b-5793-8da9-df8d76bda450","","textbox","Project Name:",,,
"text","55cece51-245a-5934-aae5-dfe106a73bc1","","textbox","Time of test:",,,
"text","8d9f88bc-a126-5ded-a630-92e2e5304180","","textbox","Grouts tested:",,,
"checkpoint-status",,"","checkpoint","Upload grout test results"

"checklist-flat",,"","checklist","","",,,1,"No",,"7a345db0c717c8811714700b422cc997ef02e9b84513be1071a6943ba34187f4"
"checkpoint-status",,"","checkpoint","Details complete"
"text","3f7eb459-930a-564b-912c-9ede888a7d67","","textbox","Date:",,,
"text","e3ec4814-c7b8-5523-85eb-d9feded10ff7","","textbox","Time truck arrived at Factory:",,,
"text","929db439-bc9f-5c4d-89cd-86c29d5ce81f","","textbox","Time truck departed Factory:",,,
"text","611c3083-8396-55c7-add1-7e80a36e0f35","","textbox","Project Name:",,,
"text","f9c4f028-e6f0-595d-ba0b-73c79d2831af","","textbox","Delivery Address:",,,
"text","96103593-91e4-5c17-bfff-c951e73ca931","","textbox","Transport Company:",,,
"text","aa2beac4-f2fc-5875-acf1-0bfe630f4c68","","textbox","Truck Registration #",,,
"text","9b3fa029-2c44-596a-9476-bd30426a1d0d","","textbox","Trailer Registration",,,
"select","775ef5e8-cb84-525e-88a7-6b2824cca26d","","dropdown","Trailer Type:","Drop Deck, Drop Deck No Frame, Flat Top, Layover, Super Layover, Commission",,
"checkpoint-status",,"","checkpoint","Upload photo of Load List used for load"
"checkpoint-status",,"","checkpoint","Upload photos of both sides of loaded truck (after being chained down)"
"checkpoint-status",,"","checkpoint","Load Declaration"
"label","9cc01920-c297-5bc1-85b6-205f7a7eecba","","note","In signing below, you agree and acknowledge that:",,,
"label","59709192-9b40-5d4e-a798-3a9779949285","","note","You are not permitted to leave the Euro Precast factory unless a Safe Load Declaration has been completed",,,
"label","570b85b3-70f7-52e7-afd9-aa05c45c915b","","note","You have been provided with a copy of the load list that indicates individual element weights and total approximate load weight (excluding trailer/frame weight)",,,
"label","767d2c5b-bc06-5bf2-b424-8b736e04a652","","note","You have chained down all units/elements in a safe and secure manner and in accordance with the latest published government/industry best practice guidance material",,,
"label","d4a2fafa-dd85-50f1-a82f-f33e1d9bf65b","","note","You will abide by all safety rules, PPE requirements and client instructions on the project site at all times.",,,
"label","05fdeed7-8860-5c0f-8238-0c4a46275295","","note","You as an individual, the truck, the trailer and load comply with the latest requirements of the Heavy Vehicle National Law and Regulations (HVNL)",,,
"holdpoint",,"","signoff","Driver Signature (must include Company)"

"checklist-sectioned",,"","checklist","","",,,45,"No",,"6f7c8514f3a28004bc0e1c38d95dae1af9ea6003bcc87cc3a63083c42b8f0d96"
"checkpoint-group",,"","section","Element Install & Grouting"
"checkpoint-status",,"","checkpoint","Bedding grout placed and finished as per project requirements"
"boolean","f35a015c-a7c5-5e72-b3c0-f1d2f643089a","","tickbox","Bedding grout (trowelable) used is as per project specification (PHOTO REQUIRED of the grout bag)",,,
"boolean","be66fcda-3418-5f56-a849-c68c2faefaf0","","tickbox","Grout mixed in line with manufacturers recommendations",,,
"boolean","13820dd0-c5ff-55f9-8df5-12a9765cb004","","tickbox","Grout bed sufficient to ensure full coverage (PHOTO REQUIRED of grout bed prior to landing element)",,,
"checkpoint-status",,"","checkpoint","Element installed to (PHOTO REQUIRED to show survey pins and spirit level bubble):"
"boolean","449b627d-d390-5c67-9f54-c718876a88c7","","tickbox","Survey Pins",,,
"boolean","5e61a5c5-4fc8-5a74-8466-e29d35a6cc0f","","tickbox","Within 5mm of vertical plumb",,,
"boolean","5eebb43a-e842-5ef7-87f0-9917d0348752","","tickbox","Face alignment within 5mm",,,
"checkpoint-status",,"","checkpoint","Element propped as per Euro Precast PEDS (PHOTO REQUIRED of element propped)"
"boolean","f7172c76-62ad-5c80-beaa-6bb5c20aea5d","","tickbox","Prop bolts installed with tool to ensure locking mechanism can't be removed by hand",,,
"checkpoint-status",,"","checkpoint","Dowel tube (flowable) grout placed and finished as per project requirements"
"boolean","0e5243ed-4fa4-5b70-b76d-d4112eb6a4b9","","tickbox","Dowel tube grout used is as per project specification (PHOTO REQUIRED of the grout bag)",,,
"boolean","2675b456-6c19-5ef3-96b9-1c0de43d4735","","tickbox","Grout mixed in line with manufacturers recommendations",,,
"boolean","5c5aeb76-5858-5a1a-b1e9-1dc78d0a5711","","tickbox","Dowel tubes filled to top of tubes",,,
"checkpoint-status",,"","checkpoint","Is there any transport or erection damage that needs to be fixed (PHOTO REQUIRED of damaged area)"
"label","400c6786-eafa-5d39-b711-d41fedab13a1","","note","If there is damage, mark as FAIL. Once the damage is repaired, take another photo (PHOTO REQUIRED) and then change the status to PASS",,,
"checkpoint-status",,"","checkpoint","Area has been cleaned from grout and rubbish (PHOTO REQUIRED of the area before leaving)"
"checkpoint-group",,"","section","HOLD POINT - Confirmation that Props can be removed"
"checkpoint-status",,"","checkpoint","Has the Builder given us written confirmation that props can be removed (UPLOAD copy of correspondence)"
"checkpoint-status",,"","checkpoint","PHOTO REQUIRED of element after the props have been removed"

