resource,type,Add Step,Add Post,Tier 1,Tier 2 ,Tier 3,Tier 4,Tier 5,Tier 6,Tier 7,Tier 8,Tier 9
,step,,,Plant & Equipment,,,,,,,,
Stomwater Pump Station PB1,checklist,,,,STORMWATER PUMP STATION PB1,,,,,,,
Stomwater Pump Station PB2,checklist,,,,STORMWATER PUMP STATION PB2,,,,,,,
Stomwater Pump Station PB5,checklist,,,,STORMWATER PUMP STATION PB5,,,,,,,
Stomwater Pump Station PB6,checklist,,,,STORMWATER PUMP STATION PB6,,,,,,,
Tank Full Diverson System ,checklist,,,,TANK FULL DIVERSON SYSTEM ,,,,,,,
Sewer Pump Station ,checklist,,,,SEWAGE PUMP STATION ,,,,,,,
Rainwater Pump Station ,checklist,,,,RAINWATER PUMP SYSTEM ,,,,,,,
Pump System Lift Well Sump,checklist,,,,PUMP SYSTEM LIFT WELL SUMP,,,,,,,
Cold Water Booster ,checklist,,,,COLD WATER BOOSTER,,,,,,,
