type,name,values,prefix,postfix,usage count,user addable,template name
checklist-flat,Switchboard Delivery ITP013 ,,,,,,Switchboard Delivery ITP013 
checkpoint,"Prior to delivery, visual inspection to coordinate delivery on site - please take a photo if delivery is unable to be completed",,,,,,
checkpoint,"Review & determine method of unloading (eg. Crane, forklift, man power, specialist subcontractor. Arrange & upload all necessary documentation",,,,,,
checkpoint,Coordinate time of delivery - take photo of delivery docket,,,,,,
checkpoint,Check delivery for damage & correct quantity,,,,,,
checkpoint,"Safely position delivery into place (eg. crane, forklift, rollers, manual, specialist subcontractor",,,,,,
label,If Ergo Group are positioning main switchboard maneuvering kit is to be delivered with main switchboard.,,,,,,
label,Distributions boards require a lifting trolley,,,,,,
checkpoint,FINAL - Pass when happy to proceed with work(s) (Any issues please comment below),,,,,,
