type,name,values,prefix,postfix,usage count,user addable,template name,Resource Id
checklist,QA - Blockwork,,,,,,QA - Blockwork,
section,Details,,,,,,,
checkpoint,Mortar mixed correctly and colour consistent,,,,,,,
checkpoint,Mortar joints are in alignment with,,,,,,,
checkpoint,Reinforce been place correctly,,,,,,,
checkpoint,Reinforce free of mortar before block fill,,,,,,,
checkpoint,Block wall plumping and levelling,,,,,,,
checkpoint,Lintel to opening been done correctly,,,,,,,
checkpoint,Control joints,,,,,,,
